[
    {
        "user_input": "What was the underlying trading operating profit in CHF millions for the year 2021?",
        "response": "According to the provided text, the underlying trading operating profit for the year 2021 was CHF 15,119 million.",
        "retrieved_contexts": [
            "As a result, trading operating profit\nincreased by 8.5% to CHF\u00a013.2\u00a0billion and the\ntrading operating profit margin was unchanged\nversus the prior year on a reported basis at 14.0%. Underlying trading operating\nprofit by operating segment\nIn % of sales\nTrading operating profit\nby operating segment\nIn % of sales\nZone NA\nZone EUR\nZone AOA\nZone LATAM\nZone GC\nNespresso\nNestl\u00e9 Health Science\n21.0%\n18.6%\n21.2%\n20.3%\n16.4%\n14.2%\n16.1%\n15.7%\n13.6%\n-9.0%\n22.9%\n22.4%\n21.5%\n20.3%\nUnderlying trading operating profit and Trading operating profit\nIn millions of CHF\nIn % of sales\nUnderlying trading operating profit\nTrading operating profit\n2021\n2021\n2022\n2022\n17.1%\n13\u2009195\n14.0%\n15\u2009119\n16\u2009103\n12\u2009159\n17.4%\n14.0%",
            "Restructuring and net other trading items was\nCHF\u00a01.1\u00a0billion compared with CHF\u00a01.5\u00a0billion in\nthe prior year, with the reduction mainly due to\nlower restructuring costs. Trading operating profit\nincreased by 0.8% to CHF\u00a014.6\u00a0billion. The trading\noperating profit margin reached 16.0%, an increase\nof 40\u00a0basis points on a reported basis and 50\u00a0basis\npoints in constant currency. Underlying trading operating profit and Trading operating profit\nIn millions of CHF\nIn % of sales\nBar chart showing underlying trading operating profit and trading operating profit, in millions of Swiss francs: 16 053 and 14 520 in 2023, 15 704 and 14 633 in 2024, respectively.\ng operating profit and t\nradi\nng o\nperating profit, in millions of Swiss francs: 16 053 and 14 520 in 2023, 15 704 and 14 633 in 2024, respectively.\u2009rat\ning profit, in millions of Swiss francs: 16 053 and 14 520 in 2023, 15 704 and 14 633 in 2024, respectively.\u2009g p\nrofit, in millions of Swiss francs: 16 053 and 14 520 in 2023, 15 704 and 14 633 in 2024, respectively.\u2009fit\n, in millions of Swiss francs: 16 053 and 14 520 in 2023, 15 704 and 14 633 in 2024, respectively.\u2009in millions of Swiss francs: 16 053 and 14 520 in 2023, 15 704 and 14 633 in 2024, respectively. Bar\nchar\nt sho\nwing\nunder\nlying trading operating profit and trading operating profit, in percentage of sales: 17.3% and 15.6% in 2023, 17.2% and 16.0% in 2024, respectively.",
            "Key sales growth drivers\n\u2013 By geography, sales in North America grew at\na mid single-digit rate with continued market\nshare gains. In Europe, sales posted close to flat\ngrowth.\n\u2013 By system, growth was driven by the Vertuo\nsystem, with strong sales momentum across\nall\u00a0geographies. Sales for out-of-home channels\ngrew at a mid single-digit rate backed by the\ncontinued rollout of the Momento system. Nespresso\nSales\nCHF 6.4 billion\nOrganic growth\n+\u20092.2%\nReal internal growth\n+\u20091.6%\nUnderlying trading operating profit margin\n20.0%\nUnderlying trading operating profit margin\n\u2013\u200930 basis points\nTrading operating profit margin\n17.0%\nTrading operating profit margin\n\u2013\u2009310 basis points\nNespresso\nIn millions of CHF\n2023\n2024\nRIG (%)\nOG (%)\nTotal sales\n6 372\n6 378\n+\u20091.6%\n+\u20092.2%\nUnderlying trading operating profit\n1 291\n1 278\n20.0%\nTrading operating profit\n1 283\n1 081\n17.0%\nCapital additions\n282\n448\n7.0%",
            "The\nunderlying tax rate decreased by 40\u00a0basis points to 20.7%,\nmainly due to the geographic and business mix. Underlying trading operating profit and Trading operating profit\nIn millions of CHF\nIn % of sales\nUnderlying trading operating profit\nTrading operating profit\n2020\n2020\n2021\n2021\n15 119\n12 159\n17.4%\n14.0%\n14 903\n14 233\n17.7%\n16.9%\nUnderlying trading operating\nprofit by operating segment\nIn % of sales\nTrading operating profit\nby operating segment\nIn % of sales\nZone AMS\nZone EMENA\nZone AOA\nNespresso\nNestl\u00e9 Health Science\n21.8%\n18.5%\n20.8%\n23.0%\n13.6%\n11.9%\n17.9%\n19.5%\n22.7%\n13.0%",
            "Significant cost inflation and the appreciation of\nthe Swiss franc more than offset pricing actions\nand cost efficiencies. The business continued to\ninvest in the rollout of the Vertuo system as well\nas\u00a0in brand marketing.\n* Interbrand annual ranking\nNespresso\nIn millions of CHF\n2022\n2023\nRIG (%)\nOG (%)\nTotal sales\n6 448\n6 372\n+\u20092.0%\n+\u20095.3%\nUnderlying trading operating profit\n1 388\n1 291\n20.3%\nTrading operating profit\n1 309\n1 283\n20.1%\nCapital additions\n520\n282\n4.4%\nNespresso\nSales\nCHF 6.4 billion\nOrganic growth\n+\u20095.3%\nReal internal growth\n+\u20092.0%\nUnderlying trading operating profit margin\n20.3%\nUnderlying trading operating profit margin\n\u2013\u2009120 basis points\nTrading operating profit margin\n20.1%\nTrading operating profit margin\n\u2013\u200920 basis points"
        ],
        "reference": "CHF 15,119 million",
        "faithfulness": 1.0,
        "answer_relevancy": 0.8625012180748927,
        "context_recall": 1.0,
        "context_precision": 0.9166666666361111
    },
    {
        "user_input": "What was the Net profit attributable to shareholders of the parent in 2022?",
        "response": "According to Nestl\u00e9 Annual Review 2022, the Net profit attributable to shareholders of the parent was CHF 9,270.",
        "retrieved_contexts": [
            "Nestl\u00e9 \u2013 Annual Review 2024\n31\nKey figures (consolidated)\nIn millions of CHF (except for data per share and employees)\n2023\n2024\nResults\nSales\n92 998\n91 354\nUnderlying trading operating profit (a)\n16 053\n15 704\nas % of sales\n17.3%\n17.2%\nTrading operating profit (a)\n14 520\n14 633\nas % of sales\n15.6%\n16.0%\nProfit for the year attributable to shareholders of the parent (Net profit)\n11 209\n10 884\nas % of sales\n12.1%\n11.9%\nBalance sheet and Cash flow statement\nTotal Equity\n36 387\n36 693\nNet financial debt (a)\n49 638\n56 005\nRatio of net financial debt to total equity (gearing)\n136.4%\n152.6%\nOperating cash flow\n15 941\n16 675\nas % of net financial debt\n32.1%\n29.8%\nFree cash flow (a)\n10 403\n10 666\nCapital additions\n7 159\n7 685\nas % of sales\n7.7%\n8.4%\nData per share\nWeighted average number of shares outstanding (in millions of units)\n2 646\n2 596\nBasic earnings per share\nCHF\n4.24\n4.19\nUnderlying earnings per share (a)\nCHF\n4.80\n4.77\nDividend as proposed by the Board of Directors of Nestl\u00e9 S.A. CHF\n3.00\n3.05\nMarket capitalization, end December\n255 604\n192 645\nNumber of employees (in thousands) (b)\n275\n277\nPrincipal key figures (c) (illustrative) in CHF, USD, EUR\nIn millions (except for data per share)\nTotal CHF\nTotal CHF\nTotal USD\nTotal USD\nTotal EUR\nTotal EUR\n2023\n2024\n2023\n2024\n2023\n2024\nSales\n92 998\n91 354\n103 584\n103 754\n95 730\n95 914\nUnderlying trading operating profit (a)\n16 053\n15 704\n17 880\n17 835\n16 525\n16 488\nTrading operating profit (a)\n14 520\n14 633\n16 173\n16 619\n14 947\n15 364\nProfit for the year attributable to shareholders of the parent (Net profit)\n11 209\n10 884\n12 485\n12 361\n11 539\n11 427\nTotal Equity\n36 387\n36 693\n43 245\n40 605\n39 081\n38 998\nMarket capitalization, end December\n255 604\n192 645\n303 784\n213 185\n274 532\n204 750\nData per share\nBasic earnings per share\n4.24\n4.19\n4.72\n4.76\n4.36\n4.40\n(a)\t \u0007Certain financial performance measures are not defined by IFRS Accounting Standards. For further details, see Foreword on page 32.\n(b)\t \u00072023 figures have been restated following the change in reference base: from full-time equivalent to headcount.\n(c)\t \u0007Income statement figures translated at average annual rate; Balance sheet figures at year-end rate.",
            "Nestl\u00e9 Annual Review 2021\n45\nKey figures (consolidated)\nIn millions of CHF (except for data per share and employees)\n2020\n2021\nResults\nSales\n84 343\n87 088\nUnderlying trading operating profit (a)\n14 903\n15 119\nas % of sales\n17.7%\n17.4%\nTrading operating profit (a)\n14 233\n12 159\nas % of sales\n16.9%\n14.0%\nProfit for the year attributable to shareholders of the parent (Net profit)\n12 232\n16 905\nas % of sales\n14.5%\n19.4%\nBalance sheet and Cash flow statement\nTotal Equity\n46 514\n53 727\nNet financial debt (a)\n31 319\n32 917\nRatio of net financial debt to total equity (gearing)\n67.3%\n61.3%\nOperating cash flow\n14 377\n13 864\nas % of net financial debt\n45.9%\n42.1%\nFree cash flow (a)\n10 245\n8 715\nCapital additions\n11 367\n12 977\nas % of sales\n13.5%\n14.9%\nData per share\nWeighted average number of shares outstanding (in millions of units)\n2 845\n2 788\nBasic earnings per share\nCHF\n4.30\n6.06\nUnderlying earnings per share (a)\nCHF\n4.21\n4.42\nDividend as proposed by the Board of Directors of Nestl\u00e9 S.A. CHF\n2.75\n2.80\nMarket capitalization, end December\n293 644\n351 682\nNumber of employees (in thousands)\n273\n276\nPrincipal key figures (b) (illustrative) in CHF, USD, EUR\nIn millions (except for data per share)\nTotal CHF\nTotal CHF\nTotal USD\nTotal USD\nTotal EUR\nTotal EUR\n2020\n2021\n2020\n2021\n2020\n2021\nSales\n84 343\n87 088\n89 982\n95 212\n78 801\n80 564\nUnderlying trading operating profit (a)\n14 903\n15 119\n15 900\n16 530\n13 924\n13 987\nTrading operating profit (a)\n14 233\n12 159\n15 185\n13 293\n13 298\n11 248\nProfit for the year attributable to shareholders of the parent (Net profit)\n12 232\n16 905\n13 050\n18 481\n11 428\n15 638\nTotal Equity\n46 514\n53 727\n52 806\n58 747\n42 939\n51 961\nMarket capitalization, end December\n293 644\n351 682\n333 364\n384 542\n271 072\n340 122\nData per share\nBasic earnings per share\n4.30\n6.06\n4.59\n6.63\n4.02\n5.61\n(a)  Certain financial performance measures are not defined by IFRS. For further details, see Foreword on page 46.\n(b)  Income statement figures translated at weighted average annual rate; Balance sheet figures at year-end rate.",
            "Nestl\u00e9 Annual Review 2022\n45\nKey figures (consolidated)\nIn millions of CHF (except for data per share and employees)\n2021\n2022\nResults\nSales\n87 088\n94 424\nUnderlying trading operating profit (a)\n15 119\n16 103\nas % of sales\n17.4%\n17.1%\nTrading operating profit (a)\n12 159\n13 195\nas % of sales\n14.0%\n14.0%\nProfit for the year attributable to shareholders of the parent (Net profit)\n16 905\n9 270\nas % of sales\n19.4%\n9.8%\nBalance sheet and Cash flow statement\nTotal Equity\n53 727\n42 792\nNet financial debt (a)\n32 917\n48 159\nRatio of net financial debt to total equity (gearing)\n61.3%\n112.5%\nOperating cash flow\n13 864\n11 907\nas % of net financial debt\n42.1%\n24.7%\nFree cash flow (a)\n8 715\n6 570\nCapital additions\n12 977\n8 264\nas % of sales\n14.9%\n8.8%\nData per share\nWeighted average number of shares outstanding (in millions of units)\n2 788\n2 707\nBasic earnings per share\nCHF\n6.06\n3.42\nUnderlying earnings per share (a)\nCHF\n4.42\n4.80\nDividend as proposed by the Board of Directors of Nestl\u00e9 S.A. CHF\n2.80\n2.95\nMarket capitalization, end December\n351 682\n285 865\nNumber of employees (in thousands)\n276\n275\nPrincipal key figures (b) (illustrative) in CHF, USD, EUR\nIn millions (except for data per share)\nTotal CHF\nTotal CHF\nTotal USD\nTotal USD\nTotal EUR\nTotal EUR\n2021\n2022\n2021\n2022\n2021\n2022\nSales\n87 088\n94 424\n95 212\n98 772\n80 564\n94 010\nUnderlying trading operating profit (a)\n15 119\n16 103\n16 530\n16 845\n13 987\n16 033\nTrading operating profit (a)\n12 159\n13 195\n13 293\n13 802\n11 248\n13 137\nProfit for the year attributable to shareholders of the parent (Net profit)\n16 905\n9 270\n18 481\n9 697\n15 638\n9 230\nTotal Equity\n53 727\n42 792\n58 747\n46 281\n51 961\n43 444\nMarket capitalization, end December\n351 682\n285 865\n384 542\n309 177\n340 122\n290 225\nData per share\nBasic earnings per share\n6.06\n3.42\n6.63\n3.58\n5.61\n3.41\n(a)\t \u0007Certain financial performance measures are not defined by IFRS. For further details, see Foreword on page 46.\n(b)\t \u0007Income statement figures translated at weighted average annual rate; Balance sheet figures at year-end rate.",
            "Nestl\u00e9 Annual Review 2023\n33\nKey figures (consolidated)\nIn millions of CHF (except for data per share and employees)\n2022\n2023\nResults\nSales\n94 424\n92 998\nUnderlying trading operating profit (a)\n16 103\n16 053\nas % of sales\n17.1%\n17.3%\nTrading operating profit (a)\n13 195\n14 520\nas % of sales\n14.0%\n15.6%\nProfit for the year attributable to shareholders of the parent (Net profit)\n9 270\n11 209\nas % of sales\n9.8%\n12.1%\nBalance sheet and Cash flow statement\nTotal Equity\n42 792\n36 387\nNet financial debt (a)\n48 159\n49 638\nRatio of net financial debt to total equity (gearing)\n112.5%\n136.4%\nOperating cash flow\n11 907\n15 941\nas % of net financial debt\n24.7%\n32.1%\nFree cash flow (a)\n6 570\n10 403\nCapital additions\n8 264\n7 159\nas % of sales\n8.8%\n7.7%\nData per share\nWeighted average number of shares outstanding (in millions of units)\n2 707\n2 646\nBasic earnings per share\nCHF\n3.42\n4.24\nUnderlying earnings per share (a)\nCHF\n4.80\n4.80\nDividend as proposed by the Board of Directors of Nestl\u00e9 S.A. CHF\n2.95\n3.00\nMarket capitalization, end December\n285 865\n255 604\nNumber of employees (in thousands)\n275\n270\nPrincipal key figures (b) (illustrative) in CHF, USD, EUR\nIn millions (except for data per share)\nTotal CHF\nTotal CHF\nTotal USD\nTotal USD\nTotal EUR\nTotal EUR\n2022\n2023\n2022\n2023\n2022\n2023\nSales\n94 424\n92 998\n98 772\n103 584\n94 010\n95 730\nUnderlying trading operating profit (a)\n16 103\n16 053\n16 845\n17 880\n16 033\n16 525\nTrading operating profit (a)\n13 195\n14 520\n13 802\n16 173\n13 137\n14 947\nProfit for the year attributable to shareholders of the parent (Net profit)\n9 270\n11 209\n9 697\n12 485\n9 230\n11 539\nTotal Equity\n42 792\n36 387\n46 281\n43 245\n43 444\n39 081\nMarket capitalization, end December\n285 865\n255 604\n309 177\n303 784\n290 225\n274 532\nData per share\nBasic earnings per share\n3.42\n4.24\n3.58\n4.72\n3.41\n4.36\n(a)\t \u0007Certain financial performance measures are not defined by IFRS Accounting Standards. For further details, see Foreword on page 34.\n(b)\t \u0007Income statement figures translated at weighted average annual rate; Balance sheet figures at year-end rate.",
            "Nestl\u00e9 \u2013 Annual Review 2025\n35\nKey figures (consolidated)\nIn millions of CHF (except for data per share and employees)\n2024\n2025\nResults\nSales\n91 354\n89 490\nUnderlying trading operating profit (a)\n15 704\n14 389\nas % of sales\n17.2%\n16.1%\nTrading operating profit (a)\n14 633\n12 675\nas % of sales\n16.0%\n14.2%\nProfit for the year attributable to shareholders of the parent (Net profit)\n10 884\n9 033\nas % of sales\n11.9%\n10.1%\nBalance sheet and Cash flow statement\nTotal Equity\n36 693\n33 058\nNet financial debt (a)\n56 005\n51 382\nRatio of net financial debt to total equity (gearing)\n152.6%\n155.4%\nOperating cash flow\n16 675\n15 904\nas % of net financial debt\n29.8%\n31.0%\nFree cash flow (a)\n10 666\n9 154\nCapital additions\n7 685\n5 351\nas % of sales\n8.4%\n6.0%\nData per share\nWeighted average number of shares outstanding (in millions of units)\n2 596\n2 573\nBasic earnings per share\nCHF\n4.19\n3.51\nUnderlying earnings per share (a)\nCHF\n4.77\n4.42\nDividend as proposed by the Board of Directors of Nestl\u00e9 S.A. CHF\n3.05\n3.10\nMarket capitalization, end December\n192 645\n202 537\nNumber of employees (in thousands)\n277\n271\nPrincipal key figures (b) (illustrative) in CHF, USD, EUR\nIn millions (except for data per share)\nTotal CHF\nTotal CHF\nTotal USD\nTotal USD\nTotal EUR\nTotal EUR\n2024\n2025\n2024\n2025\n2024\n2025\nSales\n91 354\n89 490\n103 754\n107 631\n95 914\n95 494\nUnderlying trading operating profit (a)\n15 704\n14 389\n17 835\n17 306\n16 488\n15 355\nTrading operating profit (a)\n14 633\n12 675\n16 619\n15 244\n15 364\n13 525\nProfit for the year attributable to shareholders of the parent (Net profit)\n10 884\n9 033\n12 361\n10 864\n11 427\n9 639\nTotal Equity\n36 693\n33 058\n40 605\n41 682\n38 998\n35 510\nMarket capitalization, end December\n192 645\n202 537\n213 185\n255 374\n204 750\n217 562\nData per share\nBasic earnings per share\n4.19\n3.51\n4.76\n4.22\n4.40\n3.75\n(a)\t \u0007Certain financial performance measures are not defined by IFRS Accounting Standards. For further details, see Foreword on page 36.\n(b)\t \u0007Income statement figures translated at weighted average annual rate; Balance sheet figures at year-end rate."
        ],
        "reference": "CHF 9,270 million",
        "faithfulness": 1.0,
        "answer_relevancy": 0.8551782596012975,
        "context_recall": 1.0,
        "context_precision": 0.4166666666458333
    },
    {
        "user_input": "Identify the Total Equity reported for the year 2023 in millions of CHF.",
        "response": "According to the Nestl\u00e9 Annual Review 2023, the Total Equity reported for the year 2023 in millions of CHF is 36,387.",
        "retrieved_contexts": [
            "Nestl\u00e9 Annual Review 2023\n33\nKey figures (consolidated)\nIn millions of CHF (except for data per share and employees)\n2022\n2023\nResults\nSales\n94 424\n92 998\nUnderlying trading operating profit (a)\n16 103\n16 053\nas % of sales\n17.1%\n17.3%\nTrading operating profit (a)\n13 195\n14 520\nas % of sales\n14.0%\n15.6%\nProfit for the year attributable to shareholders of the parent (Net profit)\n9 270\n11 209\nas % of sales\n9.8%\n12.1%\nBalance sheet and Cash flow statement\nTotal Equity\n42 792\n36 387\nNet financial debt (a)\n48 159\n49 638\nRatio of net financial debt to total equity (gearing)\n112.5%\n136.4%\nOperating cash flow\n11 907\n15 941\nas % of net financial debt\n24.7%\n32.1%\nFree cash flow (a)\n6 570\n10 403\nCapital additions\n8 264\n7 159\nas % of sales\n8.8%\n7.7%\nData per share\nWeighted average number of shares outstanding (in millions of units)\n2 707\n2 646\nBasic earnings per share\nCHF\n3.42\n4.24\nUnderlying earnings per share (a)\nCHF\n4.80\n4.80\nDividend as proposed by the Board of Directors of Nestl\u00e9 S.A. CHF\n2.95\n3.00\nMarket capitalization, end December\n285 865\n255 604\nNumber of employees (in thousands)\n275\n270\nPrincipal key figures (b) (illustrative) in CHF, USD, EUR\nIn millions (except for data per share)\nTotal CHF\nTotal CHF\nTotal USD\nTotal USD\nTotal EUR\nTotal EUR\n2022\n2023\n2022\n2023\n2022\n2023\nSales\n94 424\n92 998\n98 772\n103 584\n94 010\n95 730\nUnderlying trading operating profit (a)\n16 103\n16 053\n16 845\n17 880\n16 033\n16 525\nTrading operating profit (a)\n13 195\n14 520\n13 802\n16 173\n13 137\n14 947\nProfit for the year attributable to shareholders of the parent (Net profit)\n9 270\n11 209\n9 697\n12 485\n9 230\n11 539\nTotal Equity\n42 792\n36 387\n46 281\n43 245\n43 444\n39 081\nMarket capitalization, end December\n285 865\n255 604\n309 177\n303 784\n290 225\n274 532\nData per share\nBasic earnings per share\n3.42\n4.24\n3.58\n4.72\n3.41\n4.36\n(a)\t \u0007Certain financial performance measures are not defined by IFRS Accounting Standards. For further details, see Foreword on page 34.\n(b)\t \u0007Income statement figures translated at weighted average annual rate; Balance sheet figures at year-end rate.",
            "Nestl\u00e9 \u2013 Annual Review 2024\n31\nKey figures (consolidated)\nIn millions of CHF (except for data per share and employees)\n2023\n2024\nResults\nSales\n92 998\n91 354\nUnderlying trading operating profit (a)\n16 053\n15 704\nas % of sales\n17.3%\n17.2%\nTrading operating profit (a)\n14 520\n14 633\nas % of sales\n15.6%\n16.0%\nProfit for the year attributable to shareholders of the parent (Net profit)\n11 209\n10 884\nas % of sales\n12.1%\n11.9%\nBalance sheet and Cash flow statement\nTotal Equity\n36 387\n36 693\nNet financial debt (a)\n49 638\n56 005\nRatio of net financial debt to total equity (gearing)\n136.4%\n152.6%\nOperating cash flow\n15 941\n16 675\nas % of net financial debt\n32.1%\n29.8%\nFree cash flow (a)\n10 403\n10 666\nCapital additions\n7 159\n7 685\nas % of sales\n7.7%\n8.4%\nData per share\nWeighted average number of shares outstanding (in millions of units)\n2 646\n2 596\nBasic earnings per share\nCHF\n4.24\n4.19\nUnderlying earnings per share (a)\nCHF\n4.80\n4.77\nDividend as proposed by the Board of Directors of Nestl\u00e9 S.A. CHF\n3.00\n3.05\nMarket capitalization, end December\n255 604\n192 645\nNumber of employees (in thousands) (b)\n275\n277\nPrincipal key figures (c) (illustrative) in CHF, USD, EUR\nIn millions (except for data per share)\nTotal CHF\nTotal CHF\nTotal USD\nTotal USD\nTotal EUR\nTotal EUR\n2023\n2024\n2023\n2024\n2023\n2024\nSales\n92 998\n91 354\n103 584\n103 754\n95 730\n95 914\nUnderlying trading operating profit (a)\n16 053\n15 704\n17 880\n17 835\n16 525\n16 488\nTrading operating profit (a)\n14 520\n14 633\n16 173\n16 619\n14 947\n15 364\nProfit for the year attributable to shareholders of the parent (Net profit)\n11 209\n10 884\n12 485\n12 361\n11 539\n11 427\nTotal Equity\n36 387\n36 693\n43 245\n40 605\n39 081\n38 998\nMarket capitalization, end December\n255 604\n192 645\n303 784\n213 185\n274 532\n204 750\nData per share\nBasic earnings per share\n4.24\n4.19\n4.72\n4.76\n4.36\n4.40\n(a)\t \u0007Certain financial performance measures are not defined by IFRS Accounting Standards. For further details, see Foreword on page 32.\n(b)\t \u00072023 figures have been restated following the change in reference base: from full-time equivalent to headcount.\n(c)\t \u0007Income statement figures translated at average annual rate; Balance sheet figures at year-end rate.",
            "Nestl\u00e9 Annual Review 2021\n45\nKey figures (consolidated)\nIn millions of CHF (except for data per share and employees)\n2020\n2021\nResults\nSales\n84 343\n87 088\nUnderlying trading operating profit (a)\n14 903\n15 119\nas % of sales\n17.7%\n17.4%\nTrading operating profit (a)\n14 233\n12 159\nas % of sales\n16.9%\n14.0%\nProfit for the year attributable to shareholders of the parent (Net profit)\n12 232\n16 905\nas % of sales\n14.5%\n19.4%\nBalance sheet and Cash flow statement\nTotal Equity\n46 514\n53 727\nNet financial debt (a)\n31 319\n32 917\nRatio of net financial debt to total equity (gearing)\n67.3%\n61.3%\nOperating cash flow\n14 377\n13 864\nas % of net financial debt\n45.9%\n42.1%\nFree cash flow (a)\n10 245\n8 715\nCapital additions\n11 367\n12 977\nas % of sales\n13.5%\n14.9%\nData per share\nWeighted average number of shares outstanding (in millions of units)\n2 845\n2 788\nBasic earnings per share\nCHF\n4.30\n6.06\nUnderlying earnings per share (a)\nCHF\n4.21\n4.42\nDividend as proposed by the Board of Directors of Nestl\u00e9 S.A. CHF\n2.75\n2.80\nMarket capitalization, end December\n293 644\n351 682\nNumber of employees (in thousands)\n273\n276\nPrincipal key figures (b) (illustrative) in CHF, USD, EUR\nIn millions (except for data per share)\nTotal CHF\nTotal CHF\nTotal USD\nTotal USD\nTotal EUR\nTotal EUR\n2020\n2021\n2020\n2021\n2020\n2021\nSales\n84 343\n87 088\n89 982\n95 212\n78 801\n80 564\nUnderlying trading operating profit (a)\n14 903\n15 119\n15 900\n16 530\n13 924\n13 987\nTrading operating profit (a)\n14 233\n12 159\n15 185\n13 293\n13 298\n11 248\nProfit for the year attributable to shareholders of the parent (Net profit)\n12 232\n16 905\n13 050\n18 481\n11 428\n15 638\nTotal Equity\n46 514\n53 727\n52 806\n58 747\n42 939\n51 961\nMarket capitalization, end December\n293 644\n351 682\n333 364\n384 542\n271 072\n340 122\nData per share\nBasic earnings per share\n4.30\n6.06\n4.59\n6.63\n4.02\n5.61\n(a)  Certain financial performance measures are not defined by IFRS. For further details, see Foreword on page 46.\n(b)  Income statement figures translated at weighted average annual rate; Balance sheet figures at year-end rate.",
            "Nestl\u00e9 Annual Review 2022\n45\nKey figures (consolidated)\nIn millions of CHF (except for data per share and employees)\n2021\n2022\nResults\nSales\n87 088\n94 424\nUnderlying trading operating profit (a)\n15 119\n16 103\nas % of sales\n17.4%\n17.1%\nTrading operating profit (a)\n12 159\n13 195\nas % of sales\n14.0%\n14.0%\nProfit for the year attributable to shareholders of the parent (Net profit)\n16 905\n9 270\nas % of sales\n19.4%\n9.8%\nBalance sheet and Cash flow statement\nTotal Equity\n53 727\n42 792\nNet financial debt (a)\n32 917\n48 159\nRatio of net financial debt to total equity (gearing)\n61.3%\n112.5%\nOperating cash flow\n13 864\n11 907\nas % of net financial debt\n42.1%\n24.7%\nFree cash flow (a)\n8 715\n6 570\nCapital additions\n12 977\n8 264\nas % of sales\n14.9%\n8.8%\nData per share\nWeighted average number of shares outstanding (in millions of units)\n2 788\n2 707\nBasic earnings per share\nCHF\n6.06\n3.42\nUnderlying earnings per share (a)\nCHF\n4.42\n4.80\nDividend as proposed by the Board of Directors of Nestl\u00e9 S.A. CHF\n2.80\n2.95\nMarket capitalization, end December\n351 682\n285 865\nNumber of employees (in thousands)\n276\n275\nPrincipal key figures (b) (illustrative) in CHF, USD, EUR\nIn millions (except for data per share)\nTotal CHF\nTotal CHF\nTotal USD\nTotal USD\nTotal EUR\nTotal EUR\n2021\n2022\n2021\n2022\n2021\n2022\nSales\n87 088\n94 424\n95 212\n98 772\n80 564\n94 010\nUnderlying trading operating profit (a)\n15 119\n16 103\n16 530\n16 845\n13 987\n16 033\nTrading operating profit (a)\n12 159\n13 195\n13 293\n13 802\n11 248\n13 137\nProfit for the year attributable to shareholders of the parent (Net profit)\n16 905\n9 270\n18 481\n9 697\n15 638\n9 230\nTotal Equity\n53 727\n42 792\n58 747\n46 281\n51 961\n43 444\nMarket capitalization, end December\n351 682\n285 865\n384 542\n309 177\n340 122\n290 225\nData per share\nBasic earnings per share\n6.06\n3.42\n6.63\n3.58\n5.61\n3.41\n(a)\t \u0007Certain financial performance measures are not defined by IFRS. For further details, see Foreword on page 46.\n(b)\t \u0007Income statement figures translated at weighted average annual rate; Balance sheet figures at year-end rate.",
            "Nestl\u00e9 \u2013 Annual Review 2025\n35\nKey figures (consolidated)\nIn millions of CHF (except for data per share and employees)\n2024\n2025\nResults\nSales\n91 354\n89 490\nUnderlying trading operating profit (a)\n15 704\n14 389\nas % of sales\n17.2%\n16.1%\nTrading operating profit (a)\n14 633\n12 675\nas % of sales\n16.0%\n14.2%\nProfit for the year attributable to shareholders of the parent (Net profit)\n10 884\n9 033\nas % of sales\n11.9%\n10.1%\nBalance sheet and Cash flow statement\nTotal Equity\n36 693\n33 058\nNet financial debt (a)\n56 005\n51 382\nRatio of net financial debt to total equity (gearing)\n152.6%\n155.4%\nOperating cash flow\n16 675\n15 904\nas % of net financial debt\n29.8%\n31.0%\nFree cash flow (a)\n10 666\n9 154\nCapital additions\n7 685\n5 351\nas % of sales\n8.4%\n6.0%\nData per share\nWeighted average number of shares outstanding (in millions of units)\n2 596\n2 573\nBasic earnings per share\nCHF\n4.19\n3.51\nUnderlying earnings per share (a)\nCHF\n4.77\n4.42\nDividend as proposed by the Board of Directors of Nestl\u00e9 S.A. CHF\n3.05\n3.10\nMarket capitalization, end December\n192 645\n202 537\nNumber of employees (in thousands)\n277\n271\nPrincipal key figures (b) (illustrative) in CHF, USD, EUR\nIn millions (except for data per share)\nTotal CHF\nTotal CHF\nTotal USD\nTotal USD\nTotal EUR\nTotal EUR\n2024\n2025\n2024\n2025\n2024\n2025\nSales\n91 354\n89 490\n103 754\n107 631\n95 914\n95 494\nUnderlying trading operating profit (a)\n15 704\n14 389\n17 835\n17 306\n16 488\n15 355\nTrading operating profit (a)\n14 633\n12 675\n16 619\n15 244\n15 364\n13 525\nProfit for the year attributable to shareholders of the parent (Net profit)\n10 884\n9 033\n12 361\n10 864\n11 427\n9 639\nTotal Equity\n36 693\n33 058\n40 605\n41 682\n38 998\n35 510\nMarket capitalization, end December\n192 645\n202 537\n213 185\n255 374\n204 750\n217 562\nData per share\nBasic earnings per share\n4.19\n3.51\n4.76\n4.22\n4.40\n3.75\n(a)\t \u0007Certain financial performance measures are not defined by IFRS Accounting Standards. For further details, see Foreword on page 36.\n(b)\t \u0007Income statement figures translated at weighted average annual rate; Balance sheet figures at year-end rate."
        ],
        "reference": "CHF 36,387 million",
        "faithfulness": 1.0,
        "answer_relevancy": 0.84027515286746,
        "context_recall": 1.0,
        "context_precision": 0.99999999995
    },
    {
        "user_input": "What were the total sales for the Powdered and Liquid Beverages segment in 2021?",
        "response": "There is no direct information about the total sales for the Powdered and Liquid Beverages segment in 2021 in the provided context. However, the sales for specific sub-segments are mentioned. \n\nThe sub-segments mentioned under Powdered and Liquid Beverages are:\n- Nespresso: 7.5 billion CHF\n- Nescaf\u00e9 Gold Roastery: above expectations, but no specific number is given\n- Nescaf\u00e9 Ready to Drink: launched in 2022, so no sales for 2021 are mentioned\n- Milo: 4.0 billion CHF\n- Nespresso Coffee+: 24.6 billion CHF (combined with other brands)\n\nHowever, it is likely that the total sales for the Powdered and Liquid Beverages segment in 2021 is 24.6 billion CHF, but this is not explicitly stated in the provided context.",
        "retrieved_contexts": [
            "What we sell (in CHF billion)\nWhere we sell (in CHF billion)\nNumber of employees\nNumber of countries we sell in\n276 000\n186\nTotal group salaries and social\nwelfare expenses (in CHF)\nCorporate taxes paid in 2021\n(in CHF)\n14\nbillion\n2.7\nbillion\nOur business\nWe focus our energy and resources where unlocking the power of food\ncan make the greatest difference. We apply our expertise in\nnutrition, health and wellness\nto help people, families and\npets live happier, healthier\nlives. We work to protect and\nrestore the environment and\ngenerate significant value for\nour shareholders and other\nstakeholders alike. Powdered and\nLiquid Beverages\nConfectionery\nWater\n24.0\nPrepared dishes\nand cooking aids\n12.1\n7.5\n4.0\nMilk products\nand Ice cream\n10.7\nNutrition and\nHealth Science\n13.2\nPetCare\n15.6\nAMS\n39.1\nAOA\n22.2\nEMENA\n25.8",
            "What we sell (in CHF billion)\nWhere we sell (in CHF billion)\nNumber of employees\nNumber of countries we sell in\n275\u2009000\n188\nTotal group salaries and social\nwelfare expenses (in CHF)\nCorporate taxes paid in 2022\n(in CHF)\n15\nbillion\n3.1\nbillion\nOur business\nWe focus our energy and resources where unlocking the power of food\ncan make the greatest difference. We apply our expertise in\nnutrition, health and wellness\nto help people, families and\npets live happier, healthier\nlives. We work to protect and\nrestore the environment and\ngenerate significant value for\nour shareholders and other\nstakeholders alike. Powdered and\nLiquid Beverages\nConfectionery\nWater\n25.2\nPrepared dishes\nand cooking aids\n12.5\n8.1\n3.5\nMilk products\nand Ice cream\n11.3\nNutrition and\nHealth Science\n15.7\nPetCare\n18.1\nGC\n5.8\nEUR\n22.3\nAOA\n21.0\nLATAM\n12.3\nNA\n33.0",
            "Nespresso Coffee+\nThe expanded Nespresso\nCoffee+ range now offers\nfour enhanced options for\nconsumers: Melozio Boost\nand Stormio Boost with\nextra caffeine, Vivida with\nB12 and Ginseng Delight\nwith ginseng extract.\npowdered and liquid beverages\nPerfecting the world\u2019s\nfavorite beverages\nOur Powdered and Liquid Beverages category includes our\ncoffee, cocoa, malt and other beverage businesses. This category\nfeatures iconic coffee brands Nescaf\u00e9, Nespresso and Starbucks,\nplus the world\u2019s most popular chocolate malt beverage, Milo. At a glance\n24.6\nSales (in CHF\u00a0billion)\n20.0%\nUTOP margin\n26.9%\nPercentage of\nNestl\u00e9\u2019s sales",
            "Nespresso Reviving Origins\nUsing OpenSC technology,\nNespresso is bringing\ngreater transparency\nand accountability to the\nsupply chain for Reviving\nOrigins organic coffee,\nKahawa\u00a0Ya\u00a0Congo, involving\nover 1000\u00a0smallholder farms. Nescaf\u00e9 Gold Roastery\nWith sales above\nexpectations since its launch\nin 2021, the Nescaf\u00e9 Gold\nRoastery collection of instant\ncoffee is expertly roasted\nin batches by our master\nroasters to unlock the very\nbest flavors.\npowdered and liquid beverages\nProviding the world\u2019s\nfavorite drinks",
            "Box of Starbucks Iced Coffee Blend Signature Black, two cans of Nescaf\u00e9 Ready to Drink (Cappuccino and Mocha), tin of Milo Pro and sleeve of Nespresso Coffee+ Ginseng Delight. Nestl\u00e9 \u2013 Annual Review 2024\n16\nNescaf\u00e9 Ready to Drink\nLaunched in Brazil and the\nMiddle East, Nescaf\u00e9 Ready\nto Drink offers consumers\nthree great-tasting options\nfor a refreshing cold coffee\nexperience wherever and\nwhenever they desire it. Milo Pro\nLaunched in Australia for\nactive teenagers who seek\nhigh-protein beverages\nwith great taste, Milo Pro\ndelivers 15 grams of protein\nper serving when prepared\nwith milk. Starbucks Iced\nCoffee Blend\nStarbucks Iced Coffee Blend\nenables cold coffee lovers\nin the US and Canada\nto easily make delicious\ncaf\u00e9-style Signature Black\nor Vanilla iced coffee at\nhome, using K-cup pods. Nespresso Coffee+\nThe expanded Nespresso\nCoffee+ range now offers\nfour enhanced options for\nconsumers: Melozio Boost\nand Stormio Boost with\nextra caffeine, Vivida with\nB12 and Ginseng Delight\nwith ginseng extract.\npowdered and liquid beverages\nPerfecting the world\u2019s\nfavorite beverages\nOur Powdered and Liquid Beverages category includes our\ncoffee, cocoa, malt and other beverage businesses."
        ],
        "reference": "CHF 23,975 million",
        "faithfulness": 0.5,
        "answer_relevancy": 0.0,
        "context_recall": 0.0,
        "context_precision": 0.0
    },
    {
        "user_input": "What was the reported total sales figure for the Latin America and Caribbean region in 2022?",
        "response": "The reported total sales figure for the Latin America and Caribbean region in 2022 was CHF 11,819 million.",
        "retrieved_contexts": [
            "Our business\nWe apply our expertise to help people and pets live happier, healthier lives. Infographic w\nith circles repr\nesenting the\nsize\nof s\nales in billions\nof Swiss francs:\nPow\ndered and Liquid Beverages 24.6, PetCare 18.9, Nutrition and Health Science 15.1, Prepared dishes and cooking aids 10.7, Milk products and Ice cream 10.4, Confectionery 8.5, and Water\n3.2\nIn\nfog\nrap\nhic\nwit\nh ci\nrcles\non\na\nmap indicating location of sales in billions of Swiss francs: Zone North America 32.1; Zone Europe 22.1; Zone Asia, Oceania and Africa 19.2; Zone Latin America and Caribbean 12.6; and Zone Greater China 5.4. What we sell (in CHF billion)\nWhere we sell (in CHF billion)\nNumber of employees\n(headcount)\n277\u2009000\nTotal group salaries and social\nwelfare expenses (in CHF)\n14\nbillion\nCorporate taxes paid in 2024\n(in CHF)\n2.4\nbillion\nNumber of countries\nwe sell in\n185",
            "Reported sales in Zone Latin America\nincreased by 17.2% to CHF 11.8 billion. Zone Latin America saw sustained broad-based\ngrowth, supported by pricing, strong operational\nexecution and continued momentum of out-of-\nhome channels. The Zone saw market share gains\nin Infant Nutrition, pet food and culinary. Zone Latin America (LATAM)\nSales\nCHF 11.8 billion\nOrganic growth\n+\u200913.1%\nReal internal growth\n+\u20091.5%\nUnderlying trading operating profit margin\n21.2%\nUnderlying trading operating profit margin\n\u2013\u200970 basis points\nTrading operating profit margin\n20.3%\nTrading operating profit margin\n\u2013\u200910 basis points\nZone LATAM\nIn millions of CHF\n2021 *\n2022\nProportion of total sales (%)\nRIG (%)\nOG (%)\nLatin America and Caribbean\n10 086\n11 819\nPowdered and Liquid Beverages\n2 009\n2 422\n20.5%\nWater\n122\n175\n1.5%\nMilk products and Ice cream\n2 702\n3 030\n25.6%\nPrepared dishes and cooking aids\n775\n845\n7.1%\nConfectionery\n1 690\n2 067\n17.5%\nPetCare\n1 333\n1 614\n13.7%\nNutrition and Health Science\n1 455\n1 666\n14.1%\nTotal sales\n10 086\n11 819\n+\u20091.5%\n+\u200913.1%\nUnderlying trading operating profit\n2 208\n2 501\n21.2%\nTrading operating profit\n2 053\n2 401\n20.3%\nCapital additions\n687\n805\n6.8%\n*\t\u00072021 comparatives adjusted, see Foreword on page 46. Starbucks ready-to-drink products in seven\nmarkets.",
            "UTOP margin for the year declined\ndue to increased investments in growth as well as\nhigher costs linked to the acquisition of the Grupo\nCRM confectionery business. Zone Latin America (LATAM)\nSales\nCHF 11.9 billion\nOrganic growth\n+\u20092.5%\nReal internal growth\n\u2013\u20090.3%\nUnderlying trading operating profit margin\n20.4%\nUnderlying trading operating profit margin\n\u2013\u200930 basis points\nTrading operating profit margin\n19.1%\nTrading operating profit margin\n\u2013\u200910 basis points\n\u2013 Confectionery grew at a mid single-digit pace,\ndriven by KitKat and supported by new product\nlaunches.\n\u2013 PetCare achieved high single-digit growth,\nled by key brands Felix and Purina ONE.\n\u2013 Infant Nutrition posted low single-digit\ngrowth following actions to reduce customer\ninventories.\n\u2013 Dairy saw a sales decline, impacted by the\nintroduction of a sales tax in Pakistan as well\nas actions to reduce customer inventories and\nreshape the portfolio. Zone LATAM\nIn millions of CHF\n2023\n2024\nProportion of total sales (%)\nRIG (%)\nOG (%)\nLatin America and Caribbean\n12 196\n11 933\nPowdered and Liquid Beverages\n2 543\n2 511\n21.0%\nWater\n129\n45\n0.4%\nMilk products and Ice cream\n3 126\n2 971\n24.9%\nPrepared dishes and cooking aids\n888\n921\n7.7%\nConfectionery\n2 218\n2 370\n19.9%\nPetCare\n1 510\n1 445\n12.1%\nNutrition and Health Science\n1 782\n1 670\n14.0%\nTotal sales\n12 196\n11 933\n\u2013\u20090.3%\n+\u20092.5%\nUnderlying trading operating profit\n2 520\n2 429\n20.4%\nTrading operating profit\n2 346\n2 278\n19.1%\nCapital additions\n923\n1 687\n14.1%",
            "Q4-25 highlights: In Q4, the Zone delivered solid,\nbalanced growth of 3.7% OG, 2.4% pricing and\n1.3% RIG. North America OG was 2.5%, of which\nRIG was 2.4%. The sequential improvement in RIG\nwas driven by PetCare, with particular strength in\nwet cat, as capacity came online after constraints\nearlier in the year, further supported by customer\nbuy-in ahead of a price increase on 1\u00a0January. In\nLatin America, growth continued to be driven by\npricing actions for coffee and confectionery. Segment performance summary for 2025\n\u2013 Organic growth was 2.8%, with 0.1% RIG and\n2.8% pricing.\n\u2013 Reported sales were down versus the prior year\nat CHF\u00a034.5\u00a0billion, driven by a negative impact\nof 7.3% from foreign exchange movements.\n\u2013 In North America, OG was 1.0%, with 0.8% RIG\nand 0.2% pricing.",
            "Operating segments 2024 comparative figures\nhave been restated following the combination\nof Zone North America and Zone Latin America\nto form Zone Americas and Zone Greater China\nbecoming part of Zone AOA, as well as Nestl\u00e9\nWaters & Premium Beverages becoming a Globally\nManaged Business, as of January 1, 2025. Group sales\nTotal reported sales were CHF\u00a089.5\u00a0billion. Organic\ngrowth (OG) was 3.5%. Pricing contribution was\n2.8%, with targeted increases to address input cost\ninflation in coffee and cocoa-related categories. Real internal growth (RIG) was 0.8% despite price\nincreases and a challenging macroeconomic\nenvironment marked by weakening consumer\nsentiment."
        ],
        "reference": "CHF 11,819 million",
        "faithfulness": 1.0,
        "answer_relevancy": 0.9933988664638321,
        "context_recall": 1.0,
        "context_precision": 0.49999999995
    },
    {
        "user_input": "Give me the exact underlying trading operating profit for Nutrition and Health Science in 2023.",
        "response": "Unfortunately, the information provided does not include data for the year 2023. However, I can provide you with data for the years 2021, 2022, and 2024, which might be helpful in estimating the underlying trading operating profit for Nutrition and Health Science in 2023.\n\nSince the underlying trading operating profit for Nestl\u00e9 Health Science in 2022 was not directly provided, I will have to derive it using the given data. \n\nUnderlying trading operating profit for Nestl\u00e9 Health Science in 2022 is not directly available.",
        "retrieved_contexts": [
            "The\nunderlying tax rate decreased by 40\u00a0basis points to 20.7%,\nmainly due to the geographic and business mix. Underlying trading operating profit and Trading operating profit\nIn millions of CHF\nIn % of sales\nUnderlying trading operating profit\nTrading operating profit\n2020\n2020\n2021\n2021\n15 119\n12 159\n17.4%\n14.0%\n14 903\n14 233\n17.7%\n16.9%\nUnderlying trading operating\nprofit by operating segment\nIn % of sales\nTrading operating profit\nby operating segment\nIn % of sales\nZone AMS\nZone EMENA\nZone AOA\nNespresso\nNestl\u00e9 Health Science\n21.8%\n18.5%\n20.8%\n23.0%\n13.6%\n11.9%\n17.9%\n19.5%\n22.7%\n13.0%",
            "We have concluded the strategic review of our\nmainstream and value brands in VMS and are\nmoving ahead with the process to engage with\npotential buyers for these parts of the business. Segment performance summary for 2025\n\u2013 Organic growth was 3.2%, with 3.5% RIG and\n\u2013\u20090.3% pricing.\n\u2013 Reported sales decreased by 2.8% to\nCHF\u00a06.6\u00a0billion, driven by a negative foreign\nexchange impact of 5.6%.\n\u2013 Market share losses showed an improved trend\nacross all regions, particularly within the VMS\nand\u00a0Active Nutrition segments.\n\u2013 UTOP\u00a0margin increased by 210\u00a0bps to 16.1%,\ndriven by a reduction in structural costs and\nimproved gross profit margin. Key organic sales growth drivers by product\ncategory for 2025\n\u2013 By geography, North America grew low single-\ndigit, while Europe and other regions delivered\nmid single-digit growth.\n\u2013 VMS reported positive growth, driven by\npremium brands Pure Encapsulations and\nSolgar. This was partially offset by the\ndiscontinuation of some private label activities\nand sales declines in some mainstream and\nvalue brands.\n\u2013 Active Nutrition posted mid single-digit growth,\nwhich was driven by RIG-led momentum from\ninnovation and distributions gains in Orgain and\npartially offset by Vital Proteins.\n\u2013 Medical Nutrition delivered mid single-digit\ngrowth across all segments, with strong\ncontributions from Resource and Compleat. Nestl\u00e9 Health Science\nSales\nCHF 6.6 billion\nOrganic growth\n+\u20093.2%\nReal internal growth\n+\u20093.5%\nUnderlying trading operating profit margin\n16.1%\nUnderlying trading operating profit margin\n+\u2009210 basis points\nTrading operating profit margin\n10.8%\nTrading operating profit margin\n\u2013\u2009100 basis points\nNestl\u00e9 Health Science\nIn millions of CHF\n2024\n2025\nRIG (%)\nOG (%)\nTotal sales\n6 739\n6 551\n+\u20093.5%\n+\u20093.2%\nUnderlying trading operating profit\n943\n1 056\n16.1%\nTrading operating profit\n794\n709\n10.8%\nCapital additions\n522\n234\n3.6%",
            "As a result, trading operating profit\nincreased by 8.5% to CHF\u00a013.2\u00a0billion and the\ntrading operating profit margin was unchanged\nversus the prior year on a reported basis at 14.0%. Underlying trading operating\nprofit by operating segment\nIn % of sales\nTrading operating profit\nby operating segment\nIn % of sales\nZone NA\nZone EUR\nZone AOA\nZone LATAM\nZone GC\nNespresso\nNestl\u00e9 Health Science\n21.0%\n18.6%\n21.2%\n20.3%\n16.4%\n14.2%\n16.1%\n15.7%\n13.6%\n-9.0%\n22.9%\n22.4%\n21.5%\n20.3%\nUnderlying trading operating profit and Trading operating profit\nIn millions of CHF\nIn % of sales\nUnderlying trading operating profit\nTrading operating profit\n2021\n2021\n2022\n2022\n17.1%\n13\u2009195\n14.0%\n15\u2009119\n16\u2009103\n12\u2009159\n17.4%\n14.0%",
            "The underlying trading operating profit margin of\nNestl\u00e9 Health Science was unchanged versus the\nprior year, as cost synergies from newly acquired\nbusinesses and growth leverage were offset by\ncost inflation and growth investments. Nestl\u00e9 Health Science\nSales\nCHF 6.6 billion\nOrganic growth\n+\u20094.0%\nReal internal growth\n+\u20090.6%\nUnderlying trading operating profit margin\n13.6%\nUnderlying trading operating profit margin\n0 basis point\nTrading operating profit margin\n\u2013\u20099.0%\nTrading operating profit margin\n\u2013\u20092200 basis points",
            "Research and\ndevelopment costs as a percentage of sales were\nflat at 1.8%. Our Fuel for Growth program targeted savings of\nCHF\u00a00.7\u00a0billion in 2025, scaling to CHF\u00a03.0\u00a0billion by\nthe end of 2027 following the upsized target\nannounced at 9M-25. In 2025, we delivered\nsavings of CHF\u00a01.1\u00a0billion as part of this program,\nmore than CHF\u00a0350\u00a0million ahead of plan. In\naddition, we also achieved over CHF\u00a01\u00a0billion of\nsavings as part of ongoing efficiencies in 2025,\nnot\u00a0included under Fuel for Growth. Underlying trading operating profit and Trading operating profit\nIn millions of CHF\nIn % of sales\n2024\n2025\n12\u2009675\n14\u2009389\n15\u2009704\n14\u2009633\nUnderlying trading operating profit\nTrading operating profit\n2024\n2025\n16.1%\n14.2%\n17.2%\n16.0%\nUnderlying trading operating\nprofit by operating segment\nIn % of sales\nTrading operating profit\nby operating segment\nIn % of sales\n16.1%\n20.7%\n20.6%\n16.1%\n9.1%\n17.9%\n14.8%\n19.4%\n18.8%\n10.8%\n5.6%\n17.5%\nZone AMS\nZone AOA\nZone EUR\nNestl\u00e9 Health Science\nNespresso\nNW&PB"
        ],
        "reference": "CHF 2,831 million",
        "faithfulness": 1.0,
        "answer_relevancy": 0.0,
        "context_recall": 0.0,
        "context_precision": 0.249999999975
    },
    {
        "user_input": "What is a listed potential impact of \"Customer and channel management\" risks in 2021?",
        "response": "There is no information provided about \"Customer and channel management\" risks in 2021 in the given context. The text only describes the Nestl\u00e9 Group Enterprise Risk Management (ERM) framework, its processes, and the company's culture and values but does not provide specific information about the potential impacts of particular risks.",
        "retrieved_contexts": [
            "The Nestl\u00e9 Group Enterprise Risk Management\n(ERM) framework is designed to assess and\nmitigate risks in order to minimize their potential\nimpact and support the achievement of Nestl\u00e9\u2019s\nlong\u2011term purpose and business strategy. A\u00a0top\u2011down assessment is performed at\nGroup\u2011level once a year. A bottom\u2011up assessment\noccurs in parallel, resulting in aggregation of the\nindividual market assessments. This creates a\ngood understanding of the company\u2019s key risks\nin order to allocate ownership to drive specific\nactions around them and take any relevant steps to\naddress them. Additionally, Nestl\u00e9 engages with external\nstakeholders to better understand the issues that\nare of most concern to them.",
            "The Nestl\u00e9 Group Enterprise Risk Management\n(ERM) framework is designed to assess and\nmitigate risks in order to minimize their potential\nimpact and support the achievement of Nestl\u00e9\u2019s\nlong\u2011term purpose and business strategy. A\u00a0top\u2011down assessment is performed at Group-\nlevel once a year. A bottom\u2011up assessment\noccurs in parallel, resulting in aggregation of the\nindividual market assessments. This creates a\ngood understanding of the company\u2019s key risks\nin order to allocate ownership to drive specific\nactions around them and take any relevant steps\nto address them. Additionally, Nestl\u00e9 engages with external\nstakeholders to better understand the issues\nthat are of most concern to them.",
            "The Nestl\u00e9 Group Enterprise Risk Management (ERM)\nframework is designed to assess and mitigate risks in\norder to minimize their potential impact and support the\nachievement of Nestl\u00e9\u2019s long\u2011term purpose and business\nstrategy. A top\u2011down assessment is performed at Group-\nlevel once a year. A bottom\u2011up assessment occurs in\nparallel, resulting in aggregation of the individual market\nassessments. This creates a good understanding of the\ncompany\u2019s key risks in order to allocate ownership to\ndrive specific actions around them and take any relevant\nsteps to address them. Additionally, Nestl\u00e9 engages with external stakeholders\nto better understand the issues that are of most concern\nto them.",
            "The Nestl\u00e9 Group Enterprise Risk Management (ERM)\nframework is designed to assess and mitigate risks in\norder to minimize their potential impact and support the\nachievement of Nestl\u00e9\u2019s long\u2011term purpose and business\nstrategy. A top\u2011down assessment is performed at Group-\nlevel once a year. A bottom\u2011up assessment occurs in\nparallel, resulting in aggregation of the individual market\nassessments. This creates a good understanding of the\ncompany\u2019s key risks in order to allocate ownership to\ndrive specific actions around them and take any relevant\nsteps to address them. Additionally, Nestl\u00e9 engages with external stakeholders\nto better understand the issues that are of most concern\nto them.",
            "Our\nculture and values - rooted in respect for ourselves, others,\ndiversity and the future - guide our decisions and actions. Our Creating Shared Value approach helps to prioritize those\nareas that maximize value creation for shareholders and\ncultivate positive societal and environmental impacts. The Nestl\u00e9 Group Enterprise Risk Management (ERM)\nframework is designed to assess and mitigate risks in\norder to minimize their potential impact and support the\nachievement of Nestl\u00e9\u2019s long-term purpose and business\nstrategy. A top-down assessment is performed at Group-\nlevel once a year. A bottom-up assessment occurs in\nparallel, resulting in aggregation of the individual market\nassessments."
        ],
        "reference": "Reduced distribution of products to consumers.",
        "faithfulness": 1.0,
        "answer_relevancy": 0.0,
        "context_recall": 0.0,
        "context_precision": 0.0
    },
    {
        "user_input": "What main ingredients are the Maggi Nutri-licious Chatpata Besan Noodles made with according to the 2024 report?",
        "response": "According to the 2024 report, the Maggi Nutri-licious Chatpata Besan Noodles are made with nutrient dense chickpeas, rich in both protein and fiber.",
        "retrieved_contexts": [
            "Pouch and cannister of Totole Xian Matsutake Bouillon, box of Vital Pursuit Garlic Herb Grilled Chicken Bowl, sachet of Maggi Nutri-licious Chatpata Besan Noodles and jar of Maggi Magic Asia Tikka Masala. 22\nNestl\u00e9 \u2013 Annual Review 2024\nprepared dishes and cooking aids\nAdvancing delicious\nand nutritious food\nMaggi Magic Asia\nLaunched in Europe, new\nMaggi Magic Asia Tikka\nMasala offers consumers\na ready-made sauce crafted\nwith authentic spices and\nother natural ingredients,\nfor an Indian-inspired dish\nin just ten minutes. Totole\nMade from carefully\u00a0selected\nMatsutake mushrooms\u00a0from\nthe Yunnan forest, the\nnew Totole Xian Matsutake\nBouillon provides a\u00a0richer\nXian taste without\nsweeteners, artificial\nflavors or preservatives. Vital Pursuit\nNew Vital Pursuit Garlic\nHerb Grilled Chicken Bowl\nis a thoughtfully portioned,\ndelicious meal with high\nprotein and essential\nnutrients for consumers\non weight loss medications\nor a weight loss journey. Maggi Nutri-licious\nNew Maggi Nutri-licious\nChatpata Besan Noodles\nare made with nutrient\ndense chickpeas, rich in\nboth protein and fiber,\noffering Indian consumers\na\u00a0compelling dish that is\nboth spicy and tangy.",
            "Maggi Nutri-licious\nNew Maggi Nutri-licious\nChatpata Besan Noodles\nare made with nutrient\ndense chickpeas, rich in\nboth protein and fiber,\noffering Indian consumers\na\u00a0compelling dish that is\nboth spicy and tangy. Our prepared dishes and cooking aids category provides daily\nessentials, including bouillons, chilled culinary products, and frozen\nfood and pizzas. Iconic brands such as Maggi, Stouffer\u2019s and DiGiorno\ncater to regional and local tastes. At a glance\n10.7\nSales (in CHF\u00a0billion)\n19.9%\nUTOP margin\n11.7%\nPercentage of\nNestl\u00e9\u2019s sales",
            "Not only does this\nprovide a convenient and affordable\nway to deliver the flavor of meat\nat a fraction of the cost, Maggi Soya\nChunks also provides a nutritious\nsource of protein, iron and zinc. Nestl\u00e9 continues to create new\noptions that provide quality protein\nthrough grains. As part of the\nInternational Year of Millets 2023,\nwe launched Maggi Nutri-licious\nMasala Oats Noodles with Millet\nMagic. This product leverages\nthe power of these ancient grains\nto bring protein and fiber to\nIndian consumers in one of their\nfavorite meals. Increasing\naccess to\nquality meals\nShivani Hegde\nGlobal Category Leader,\nAffordable Nutrition\nSwitzerland\nOUR VOICES\n\u201cWe innovate to support\nconsumers in creating\naffordable, delicious and\nnutritious meals every day.\u201d\nIN FIGURES\n12.6%\norganic growth for affordable nutrition food\nproducts in 2023",
            "The popular Maggi Veggie Masala\nNoodles has the same iconic taste\nas the original but now includes\nnutritious carrots and beans. Plus,\nMaggi offers recipes to cook delicious\nplant-based meals from scratch. Plant-based versions of the popular\nWagner Piccolinis have now entered\nmore homes, providing vegan and\nvegetarian options. And the new\nThomy Vegan Tartare offers a plant-\nbased sauce option. Our plant-based innovations are\nproving that we can offer consumers\nhealthy options with a lower\nenvironmental burden that taste great.",
            "To respond to these\ngrowth opportunities, Nestl\u00e9 unveiled\nnew authentic noodle offerings through\nthe world cuisine platform. This\nstrategic initiative targets high-growth\nsegments and rising demand for global\nflavors. In Europe, Maggi launched\nSaucy Noodles with recipes such\nas Japanese Teriyaki and Pad Thai,\nhelping Asian food lovers prepare a\ndelicious small meal in minutes. Fueled\nby this initiative, noodles became\nthe largest growth driver for our food\ncategory in 2025. Spicing up air fryer meals\nWithin the food category we are\npursuing growth by expanding our\nportfolio of products that make the\npreparation of tasty meals easier\nusing modern devices."
        ],
        "reference": "Nutrient dense chickpeas, rich in protein and fiber.",
        "faithfulness": 1.0,
        "answer_relevancy": 0.9024684109317959,
        "context_recall": 1.0,
        "context_precision": 0.99999999995
    },
    {
        "user_input": "How did total Group Sales change from 2021 to 2023? Provide the exact figures in millions of CHF.",
        "response": "According to the Nestl\u00e9 Annual Review 2024, Group Sales in 2021 was 87,088 million CHF and in 2023 was 92,998 million CHF. \n\nTherefore, the change in total Group Sales from 2021 to 2023 was an increase of 5,910 million CHF (92,998 - 87,088).",
        "retrieved_contexts": [
            "Nestl\u00e9 \u2013 Annual Review 2024\n31\nKey figures (consolidated)\nIn millions of CHF (except for data per share and employees)\n2023\n2024\nResults\nSales\n92 998\n91 354\nUnderlying trading operating profit (a)\n16 053\n15 704\nas % of sales\n17.3%\n17.2%\nTrading operating profit (a)\n14 520\n14 633\nas % of sales\n15.6%\n16.0%\nProfit for the year attributable to shareholders of the parent (Net profit)\n11 209\n10 884\nas % of sales\n12.1%\n11.9%\nBalance sheet and Cash flow statement\nTotal Equity\n36 387\n36 693\nNet financial debt (a)\n49 638\n56 005\nRatio of net financial debt to total equity (gearing)\n136.4%\n152.6%\nOperating cash flow\n15 941\n16 675\nas % of net financial debt\n32.1%\n29.8%\nFree cash flow (a)\n10 403\n10 666\nCapital additions\n7 159\n7 685\nas % of sales\n7.7%\n8.4%\nData per share\nWeighted average number of shares outstanding (in millions of units)\n2 646\n2 596\nBasic earnings per share\nCHF\n4.24\n4.19\nUnderlying earnings per share (a)\nCHF\n4.80\n4.77\nDividend as proposed by the Board of Directors of Nestl\u00e9 S.A. CHF\n3.00\n3.05\nMarket capitalization, end December\n255 604\n192 645\nNumber of employees (in thousands) (b)\n275\n277\nPrincipal key figures (c) (illustrative) in CHF, USD, EUR\nIn millions (except for data per share)\nTotal CHF\nTotal CHF\nTotal USD\nTotal USD\nTotal EUR\nTotal EUR\n2023\n2024\n2023\n2024\n2023\n2024\nSales\n92 998\n91 354\n103 584\n103 754\n95 730\n95 914\nUnderlying trading operating profit (a)\n16 053\n15 704\n17 880\n17 835\n16 525\n16 488\nTrading operating profit (a)\n14 520\n14 633\n16 173\n16 619\n14 947\n15 364\nProfit for the year attributable to shareholders of the parent (Net profit)\n11 209\n10 884\n12 485\n12 361\n11 539\n11 427\nTotal Equity\n36 387\n36 693\n43 245\n40 605\n39 081\n38 998\nMarket capitalization, end December\n255 604\n192 645\n303 784\n213 185\n274 532\n204 750\nData per share\nBasic earnings per share\n4.24\n4.19\n4.72\n4.76\n4.36\n4.40\n(a)\t \u0007Certain financial performance measures are not defined by IFRS Accounting Standards. For further details, see Foreword on page 32.\n(b)\t \u00072023 figures have been restated following the change in reference base: from full-time equivalent to headcount.\n(c)\t \u0007Income statement figures translated at average annual rate; Balance sheet figures at year-end rate.",
            "Nestl\u00e9 Annual Review 2021\n45\nKey figures (consolidated)\nIn millions of CHF (except for data per share and employees)\n2020\n2021\nResults\nSales\n84 343\n87 088\nUnderlying trading operating profit (a)\n14 903\n15 119\nas % of sales\n17.7%\n17.4%\nTrading operating profit (a)\n14 233\n12 159\nas % of sales\n16.9%\n14.0%\nProfit for the year attributable to shareholders of the parent (Net profit)\n12 232\n16 905\nas % of sales\n14.5%\n19.4%\nBalance sheet and Cash flow statement\nTotal Equity\n46 514\n53 727\nNet financial debt (a)\n31 319\n32 917\nRatio of net financial debt to total equity (gearing)\n67.3%\n61.3%\nOperating cash flow\n14 377\n13 864\nas % of net financial debt\n45.9%\n42.1%\nFree cash flow (a)\n10 245\n8 715\nCapital additions\n11 367\n12 977\nas % of sales\n13.5%\n14.9%\nData per share\nWeighted average number of shares outstanding (in millions of units)\n2 845\n2 788\nBasic earnings per share\nCHF\n4.30\n6.06\nUnderlying earnings per share (a)\nCHF\n4.21\n4.42\nDividend as proposed by the Board of Directors of Nestl\u00e9 S.A. CHF\n2.75\n2.80\nMarket capitalization, end December\n293 644\n351 682\nNumber of employees (in thousands)\n273\n276\nPrincipal key figures (b) (illustrative) in CHF, USD, EUR\nIn millions (except for data per share)\nTotal CHF\nTotal CHF\nTotal USD\nTotal USD\nTotal EUR\nTotal EUR\n2020\n2021\n2020\n2021\n2020\n2021\nSales\n84 343\n87 088\n89 982\n95 212\n78 801\n80 564\nUnderlying trading operating profit (a)\n14 903\n15 119\n15 900\n16 530\n13 924\n13 987\nTrading operating profit (a)\n14 233\n12 159\n15 185\n13 293\n13 298\n11 248\nProfit for the year attributable to shareholders of the parent (Net profit)\n12 232\n16 905\n13 050\n18 481\n11 428\n15 638\nTotal Equity\n46 514\n53 727\n52 806\n58 747\n42 939\n51 961\nMarket capitalization, end December\n293 644\n351 682\n333 364\n384 542\n271 072\n340 122\nData per share\nBasic earnings per share\n4.30\n6.06\n4.59\n6.63\n4.02\n5.61\n(a)  Certain financial performance measures are not defined by IFRS. For further details, see Foreword on page 46.\n(b)  Income statement figures translated at weighted average annual rate; Balance sheet figures at year-end rate.",
            "Nestl\u00e9 Annual Review 2022\n45\nKey figures (consolidated)\nIn millions of CHF (except for data per share and employees)\n2021\n2022\nResults\nSales\n87 088\n94 424\nUnderlying trading operating profit (a)\n15 119\n16 103\nas % of sales\n17.4%\n17.1%\nTrading operating profit (a)\n12 159\n13 195\nas % of sales\n14.0%\n14.0%\nProfit for the year attributable to shareholders of the parent (Net profit)\n16 905\n9 270\nas % of sales\n19.4%\n9.8%\nBalance sheet and Cash flow statement\nTotal Equity\n53 727\n42 792\nNet financial debt (a)\n32 917\n48 159\nRatio of net financial debt to total equity (gearing)\n61.3%\n112.5%\nOperating cash flow\n13 864\n11 907\nas % of net financial debt\n42.1%\n24.7%\nFree cash flow (a)\n8 715\n6 570\nCapital additions\n12 977\n8 264\nas % of sales\n14.9%\n8.8%\nData per share\nWeighted average number of shares outstanding (in millions of units)\n2 788\n2 707\nBasic earnings per share\nCHF\n6.06\n3.42\nUnderlying earnings per share (a)\nCHF\n4.42\n4.80\nDividend as proposed by the Board of Directors of Nestl\u00e9 S.A. CHF\n2.80\n2.95\nMarket capitalization, end December\n351 682\n285 865\nNumber of employees (in thousands)\n276\n275\nPrincipal key figures (b) (illustrative) in CHF, USD, EUR\nIn millions (except for data per share)\nTotal CHF\nTotal CHF\nTotal USD\nTotal USD\nTotal EUR\nTotal EUR\n2021\n2022\n2021\n2022\n2021\n2022\nSales\n87 088\n94 424\n95 212\n98 772\n80 564\n94 010\nUnderlying trading operating profit (a)\n15 119\n16 103\n16 530\n16 845\n13 987\n16 033\nTrading operating profit (a)\n12 159\n13 195\n13 293\n13 802\n11 248\n13 137\nProfit for the year attributable to shareholders of the parent (Net profit)\n16 905\n9 270\n18 481\n9 697\n15 638\n9 230\nTotal Equity\n53 727\n42 792\n58 747\n46 281\n51 961\n43 444\nMarket capitalization, end December\n351 682\n285 865\n384 542\n309 177\n340 122\n290 225\nData per share\nBasic earnings per share\n6.06\n3.42\n6.63\n3.58\n5.61\n3.41\n(a)\t \u0007Certain financial performance measures are not defined by IFRS. For further details, see Foreword on page 46.\n(b)\t \u0007Income statement figures translated at weighted average annual rate; Balance sheet figures at year-end rate.",
            "In the medium\nterm, we continue to expect organic sales growth\nto be at 4% plus in a normal operating environment,\nwith an underlying trading operating profit margin\nat 17.0% plus. Sales, employees and factories by geographic area\nSales\nEmployees (a)\nFactories\n2023\n2024\n2023\n2024\n2023\n2024\nNA\n35.0%\n35.2%\n14.7%\n14.2%\n56\n56\nEUR (b)\n24.0%\n24.2%\n28.9%\n28.9%\n96\n93\nAOA\n21.4%\n21.0%\n25.9%\n25.5%\n100\n100\nLATAM\n13.7%\n13.7%\n21.9%\n22.8%\n65\n65\nGC\n5.9%\n5.9%\n8.6%\n8.6%\n23\n23\n(a)\t \u00072023 figures have been restated following the change in reference base: from full-time equivalent to headcount.\n(b)\t \u00078566 employees in Switzerland in 2024 (2023: 8678 employees). Employees by activity (a)\nIn thousands\n2023\n2024\nFactories\n135\n139\nAdministration and sales\n140\n138\nTotal\n275\n277\n(a)\t \u00072023 figures have been restated following the change in reference base: from full-time equivalent to headcount.",
            "Nestl\u00e9 Annual Review 2021\n33\nPro Plan CardioCare\nwas launched in 2021\nwithin the Purina Pro\nPlan Veterinary Diets\nrange, proven to\nslow the progression\nof Myxomatous\nMitral Valve Disease\n(MMVD) in dogs. IN FIGURES\nPurina Pro Plan LiveClear is the\nfirst and only cat food that reduces\nallergens in cat hair and dander, a\nculmination of more than a decade of\nPurina research. This groundbreaking\napproach to cat allergen management\nhas the power to change lives, helping\ncat owners be closer together with\nthe cats they love. Managing cat allergens is a struggle\nfor one in five adults worldwide. Sadly,\nthis can limit the interactions between\npeople and their cats."
        ],
        "reference": "Total sales increased from CHF 87,088 million in 2021 to CHF 92,998 million in 2023.",
        "faithfulness": 0.75,
        "answer_relevancy": 0.7145213290496486,
        "context_recall": 1.0,
        "context_precision": 0.0
    },
    {
        "user_input": "Compare the total sales for the Water segment from 2021 to 2022. Did it grow or shrink?",
        "response": "The question does not provide any direct sales figures for the Water segment for 2021 and 2022. However, we can infer some information about Nestl\u00e9 Waters' performance.\n\nIn 2021, Nestl\u00e9 acquired Essentia, the #1 alkaline water brand and the #1 selling bottled water brand in the U.S. natural channel, with sales in over 100,000 U.S. retail locations. This acquisition provided Nestl\u00e9 with a strong presence in the high-growth, functional water segment.\n\nIn 2022, Nestl\u00e9 Waters continued to make progress toward its sustainability goals, with a focus on protecting water resources in terms of quantity and quality. The company also highlighted its efforts to capture opportunities with emerging consumer trends, such as healthy hydration.\n\nHowever, we cannot determine if the total sales for the Water segment grew or shrunk based on the provided information. We only have indirect insights into the performance of the Water segment, but no direct sales figures.",
        "retrieved_contexts": [
            "Nestl\u00e9 Annual Review 2021\n43\nMeeting the demand for functional water in\nItaly is the Levissima+ range, offering four\nvariants of Italian mineral water infused with\nminerals or vitamins. Nestl\u00e9 acquired Essentia in March\n2021 as part of the continued\ntransformation of our global water\nbusiness to focus on international\npremium and mineral water brands\nand healthy hydration products. Essentia pioneered ionized alkaline\nwater more than twenty years ago\nand is leading in that space. Essentia is the #1 alkaline water brand\nand the #1 selling bottled water brand\nin the U.S. natural channel. It is sold in\nmore than 100\u00a0000\u00a0U.S. retail locations.",
            "Purina Pro Plan\nVeterinary Supplements FortiFlora is\nthe #1 U.S. recommended probiotic\nby veterinarians. It is a proprietary\nprobiotic supplement that supports\ndigestive health and helps improve\nstool quality in dogs and cats. Water is crucial for cats, just like it is\nfor humans. Many cats dislike drinking\nwater \u2013 especially still or stagnant\nwater \u2013 which can lead to dehydration. Purina Pro Plan Hydra Care addresses\nthis, offering nutrient-enriched water\nfor cats.",
            "Finally, the ionization process removes\nbitter-tasting acidic ions, which results\nin a water with a pH of 9.5 or higher,\ndelivering a clean, smooth taste. Essentia is CarbonNeutral certified for\npackaging under The CarbonNeutral\nProtocol, the leading global standard\nfor carbon-neutral programs. Essentia gives Nestl\u00e9 an immediate\nstrong presence in the high-\ngrowth, functional water segment\nand supports efforts to capture\nopportunities with emerging\nconsumer trends such as healthy\nhydration. Essentia also brings a\nstrong, passionate following of\ninfluencers known as \u201cEssentia\nNation\u201d that includes high-profile\nathletes and celebrities. Meeting\ndemand for\nfunctional\nwater\nIn 2021, Essentia launched a new 2 gallon\n(7.57 liter) bag-in-box format with recycled\nand recyclable corrugate and 80% less plastic\nthan bottles.",
            "Nestl\u00e9 Annual Review 2022\n22\nThe Nestl\u00e9 Youth\nEntrepreneurship\nPlatform is a one-stop\nshop where young\npeople can gain\naccess to knowledge\nand facilities, such\nas our technology\ncenters and\ninternational network\nof R+D Accelerators.\nof each plan. Our framework and action plans will help us\nprotect people, first and foremost, as well as stay ahead\nof emerging human rights due diligence legislation in the\nmarkets where we operate. Creating youth opportunities\nAs part of our Nestl\u00e9 needs YOUth initiative, in August we\nbrought together all our existing youth innovation initiatives\nin one place on the Nestl\u00e9 Youth Entrepreneurship Platform\n(YEP). This digital platform supports young innovators\nand entrepreneurs who want to gain new knowledge and\nskills, test an idea or grow their businesses in areas ranging\nfrom food science and technology to the development of\nproducts and services, including sustainable packaging and\nregenerative agriculture. Nestl\u00e9 created access to economic\nopportunities for a total of 1.7\u00a0million young people in 2022,\nbringing the total since 2017 to 5.6 million.",
            "Nestl\u00e9 Annual Review 2022\n43\nAt Nestl\u00e9 Waters, protection of\nwater resources in terms of quantity\nand quality is at the heart of our\nsustainability strategy. This is\ncrucial both for our operations and\nfor the communities located in the\nwatersheds where we operate. We are\nunwavering in our commitment and\ncontinued to make progress toward\nour goals in 2022. For several years now, we have used the\nAlliance for Water Stewardship (AWS)\nStandard to structure our understanding\nand drive actions to support good water\nstewardship. Created by prominent\nconservation organizations and\nexperts, adoption of the AWS Standard\nis helping us strengthen the collection\nand sharing of data on watersheds,\nengage with local stakeholders and\ncommunities, and analyze shared water\nchallenges to design tailored action\nplans, including collective initiatives\nwithin the watershed."
        ],
        "reference": "It shrank by CHF 504 million, dropping from CHF 4,040 million in 2021 to CHF 3,536 million in 2022.",
        "faithfulness": 0.5,
        "answer_relevancy": 0.8768047052291316,
        "context_recall": 0.0,
        "context_precision": 0.0
    },
    {
        "user_input": "Track the Net financial debt from 2022 to 2023. By how much did it increase?",
        "response": "Based on the provided context from Nestl\u00e9 Annual Review 2022 and Nestl\u00e9 Annual Review 2023:\n\n- In 2022, the net financial expenses were CHF 1.0 billion.\n- In 2023, the net financial expenses increased to CHF 1.4 billion.\n\nThe increase in net financial expenses from 2022 to 2023 is CHF 1.4 billion - CHF 1.0 billion = CHF 0.4 billion.\n\nHowever, the question asked for the net financial debt. The net financial debt is not explicitly mentioned in the provided context. The context mentions \"Net financial expenses\" and \"average net debt\". \n\nIf we consider the \"average net debt\" mentioned in the context, in 2022, the average cost of net debt was 2.2% and in 2023, it increased to 2.5%. Unfortunately, the exact average net debt amount for 2022 and 2023 is not provided.",
        "retrieved_contexts": [
            "Nestl\u00e9 \u2013 Annual Review 2024\n35\nNet financial expenses and Income tax\nNet financial expenses increased to CHF\u00a01.5\u00a0billion\nfrom CHF\u00a01.4\u00a0billion, reflecting a higher level of\naverage net debt and an increase in interest rates. The average cost of net debt was 2.6% compared\nto 2.5% in\u00a02023. The Group reported tax rate was 25.0%, compared\nto 18.2% in the prior year. The increase was\nmainly due to a write-off in deferred tax assets\nfrom changes in utilization projections and\nthe\u00a0absence of the favorable one-off items that\npositively impacted 2023. The underlying tax rate\nincreased by 70\u00a0basis points to 21.9%, driven\nby higher corporate and withholding tax rates\nin some jurisdictions, as well as changes in the\ngeographical and business mix of profits.",
            "Nestl\u00e9 Annual Review 2022\n49\nNet financial expenses and Income tax\nNet financial expenses increased by 19.2% to\nCHF\u00a01.0\u00a0billion, reflecting higher average net debt. Our average cost of net debt increased slightly to\n2.2%, compared to 2.0% in 2021. The Group reported tax rate increased by 330\u00a0basis\npoints to 24.2% as a result of one-off items. The\nunderlying tax rate was relatively stable at 20.9%. Net profit and Earnings per share\nNet profit decreased by 45.2% to CHF\u00a09.3\u00a0billion.",
            "At the upcoming Annual General Meeting, the\nBoard of Directors will propose the cancellation\nof the remaining 43.5\u00a0million repurchased shares,\nreducing the share capital of Nestl\u00e9\u00a0S.A. from\nCHF\u00a0262\u2009000\u2009000 to CHF\u00a0257\u2009652\u2009000. We do not\ncurrently anticipate initiating a new share buyback\nprogram in 2025. Net debt\nNet debt was CHF\u00a056.0\u00a0billion as at December\u00a031,\n2024, compared to CHF 49.6 billion at December\u00a031,\n2023. The increase largely reflected cash outflows\nfor the dividend payment of CHF\u00a07.8\u00a0billion and\nshare buybacks of CHF\u00a04.5\u00a0billion as well as the\nimpact of foreign exchange movements. The ratio\nof net debt to Adjusted EBITDA was 2.90\u00a0times\nat December\u00a031, 2024, compared to 2.54\u00a0times\nat December\u00a031, 2023.",
            "Our net zero\npledge one\nyear on\nIn December 2020, Nestl\u00e9 published a detailed and rigorous Net Zero\nRoadmap showing how we plan to halve our direct and indirect GHG\nemissions by 2030 versus a 2018 baseline and achieve net zero by\n2050 \u2013 as our business continues to grow. The Skimmelkrans Net Zero Carbon\nEmissions Project in South Africa. We aim to create the company\u2019s\nfirst net zero dairy farm by 2023.",
            "Nestl\u00e9 Annual Review 2023\n37\nNet financial expenses and Income tax\nNet financial expenses increased to CHF\u00a01.4\u00a0billion,\nreflecting an increase in interest rates and a higher\nlevel of average net debt. The average cost of net\ndebt was 2.5% compared to 2.2% in 2022. The Group reported tax rate decreased by\n600\u00a0basis points to 18.2% as a result of one\u2011off\nitems. The underlying tax rate increased by\n30\u00a0basis points to 21.2%, mainly due to the\ngeographic and business mix. Net profit and Earnings per share\nNet profit increased by 20.9% to CHF\u00a011.2\u00a0billion."
        ],
        "reference": "It increased by CHF 1,479 million, going from CHF 48,159 million in 2022 to CHF 49,638 million in 2023.",
        "faithfulness": 0.72,
        "answer_relevancy": 0.0,
        "context_recall": 0.0,
        "context_precision": 0.0
    },
    {
        "user_input": "Look at the Latin America and Caribbean sales segment. How did the revenue figures change from 2021 to 2023?",
        "response": "According to the provided information, the revenue figures for the Latin America and Caribbean sales segment changed as follows:\n\n- 2021: CHF 10,086 million\n- 2023: CHF 12,196 million\n\nThis represents an increase of approximately 21.2% from 2021 to 2023.",
        "retrieved_contexts": [
            "In the medium\nterm, we continue to expect organic sales growth\nto be at 4% plus in a normal operating environment,\nwith an underlying trading operating profit margin\nat 17.0% plus. Sales, employees and factories by geographic area\nSales\nEmployees (a)\nFactories\n2023\n2024\n2023\n2024\n2023\n2024\nNA\n35.0%\n35.2%\n14.7%\n14.2%\n56\n56\nEUR (b)\n24.0%\n24.2%\n28.9%\n28.9%\n96\n93\nAOA\n21.4%\n21.0%\n25.9%\n25.5%\n100\n100\nLATAM\n13.7%\n13.7%\n21.9%\n22.8%\n65\n65\nGC\n5.9%\n5.9%\n8.6%\n8.6%\n23\n23\n(a)\t \u00072023 figures have been restated following the change in reference base: from full-time equivalent to headcount.\n(b)\t \u00078566 employees in Switzerland in 2024 (2023: 8678 employees). Employees by activity (a)\nIn thousands\n2023\n2024\nFactories\n135\n139\nAdministration and sales\n140\n138\nTotal\n275\n277\n(a)\t \u00072023 figures have been restated following the change in reference base: from full-time equivalent to headcount.",
            "Nestl\u00e9 Annual Review 2021\n53\nReview of Zones, Nespresso\nand Nestl\u00e9 Health Science\nZone Americas (AMS)\n\u2013 8.5% organic growth: 4.8% RIG; 3.7% pricing.\n\u2013 North America posted high single-digit organic growth,\nwith robust RIG and positive pricing.\n\u2013 Latin America reported double-digit organic growth,\nwith both strong RIG and pricing.\n\u2013 The underlying trading operating profit margin increased\nby 30\u00a0basis points to 20.8%, mainly due to the divestment\nof the Nestl\u00e9 Waters North America brands. Organic growth was 8.5%, with strong RIG of 4.8%. Pricing\nincreased to 3.7%, reaching 5.2% in the fourth quarter. Net\ndivestitures reduced sales by 6.6%, as the divestment of the\nNestl\u00e9 Waters North America brands more than offset the\nacquisitions of Freshly and Essentia Water. Foreign exchange\nhad a negative impact of 2.5%.",
            "Reported sales in Zone Latin America\nincreased by 17.2% to CHF 11.8 billion. Zone Latin America saw sustained broad-based\ngrowth, supported by pricing, strong operational\nexecution and continued momentum of out-of-\nhome channels. The Zone saw market share gains\nin Infant Nutrition, pet food and culinary. Zone Latin America (LATAM)\nSales\nCHF 11.8 billion\nOrganic growth\n+\u200913.1%\nReal internal growth\n+\u20091.5%\nUnderlying trading operating profit margin\n21.2%\nUnderlying trading operating profit margin\n\u2013\u200970 basis points\nTrading operating profit margin\n20.3%\nTrading operating profit margin\n\u2013\u200910 basis points\nZone LATAM\nIn millions of CHF\n2021 *\n2022\nProportion of total sales (%)\nRIG (%)\nOG (%)\nLatin America and Caribbean\n10 086\n11 819\nPowdered and Liquid Beverages\n2 009\n2 422\n20.5%\nWater\n122\n175\n1.5%\nMilk products and Ice cream\n2 702\n3 030\n25.6%\nPrepared dishes and cooking aids\n775\n845\n7.1%\nConfectionery\n1 690\n2 067\n17.5%\nPetCare\n1 333\n1 614\n13.7%\nNutrition and Health Science\n1 455\n1 666\n14.1%\nTotal sales\n10 086\n11 819\n+\u20091.5%\n+\u200913.1%\nUnderlying trading operating profit\n2 208\n2 501\n21.2%\nTrading operating profit\n2 053\n2 401\n20.3%\nCapital additions\n687\n805\n6.8%\n*\t\u00072021 comparatives adjusted, see Foreword on page 46. Starbucks ready-to-drink products in seven\nmarkets.",
            "Reported sales in\nNespresso decreased by 1.2% to CHF\u00a06.4\u00a0billion. The key growth contributor was the Vertuo\nsystem, which continued to see broad-based\nmomentum. Growth in out-of-home channels was\nalso strong, with further adoption of the Momento\nsystem, particularly in the office segment. Innovation continued to resonate with consumers,\nincluding the launch of home compostable\ncoffee capsules and the ultra-premium N\u00b020\nlimited edition, a unique arabica variety. In 2023,\nNespresso was recognized as one of the top\u00a0100\nmost valuable brands in the world.*\nBy geography, North America posted double-\ndigit growth, with continued market share gains.",
            "UTOP margin for the year declined\ndue to increased investments in growth as well as\nhigher costs linked to the acquisition of the Grupo\nCRM confectionery business. Zone Latin America (LATAM)\nSales\nCHF 11.9 billion\nOrganic growth\n+\u20092.5%\nReal internal growth\n\u2013\u20090.3%\nUnderlying trading operating profit margin\n20.4%\nUnderlying trading operating profit margin\n\u2013\u200930 basis points\nTrading operating profit margin\n19.1%\nTrading operating profit margin\n\u2013\u200910 basis points\n\u2013 Confectionery grew at a mid single-digit pace,\ndriven by KitKat and supported by new product\nlaunches.\n\u2013 PetCare achieved high single-digit growth,\nled by key brands Felix and Purina ONE.\n\u2013 Infant Nutrition posted low single-digit\ngrowth following actions to reduce customer\ninventories.\n\u2013 Dairy saw a sales decline, impacted by the\nintroduction of a sales tax in Pakistan as well\nas actions to reduce customer inventories and\nreshape the portfolio. Zone LATAM\nIn millions of CHF\n2023\n2024\nProportion of total sales (%)\nRIG (%)\nOG (%)\nLatin America and Caribbean\n12 196\n11 933\nPowdered and Liquid Beverages\n2 543\n2 511\n21.0%\nWater\n129\n45\n0.4%\nMilk products and Ice cream\n3 126\n2 971\n24.9%\nPrepared dishes and cooking aids\n888\n921\n7.7%\nConfectionery\n2 218\n2 370\n19.9%\nPetCare\n1 510\n1 445\n12.1%\nNutrition and Health Science\n1 782\n1 670\n14.0%\nTotal sales\n12 196\n11 933\n\u2013\u20090.3%\n+\u20092.5%\nUnderlying trading operating profit\n2 520\n2 429\n20.4%\nTrading operating profit\n2 346\n2 278\n19.1%\nCapital additions\n923\n1 687\n14.1%"
        ],
        "reference": "Revenue grew from CHF 10,086 million in 2021 to CHF 12,196 million in 2023.",
        "faithfulness": 0.6666666666666666,
        "answer_relevancy": 0.9472822368137492,
        "context_recall": 1.0,
        "context_precision": 0.0
    },
    {
        "user_input": "Did Ice cream sales increase or decrease from 2022 to 2023?",
        "response": "Since the Ice Cream sales figure is not directly provided in the given information, we need to extract it from the provided data. \n\nFrom the Nestl\u00e9 Annual Review 2022:\n- Sales (in CHF billion): 22.7% of Nestl\u00e9\u2019s sales\n- Percentage of Nestl\u00e9\u2019s sales: 22.7% is equivalent to 22.7 billion CHF, but we need to know the total sales. We can't deduce the total sales value from the given data. However, we know the ice cream business offers a variety of special treats.\n\nFrom the Nestl\u00e9 Annual Review 2023:\n- Sales (in CHF billion): 11.0% of Nestl\u00e9\u2019s sales is provided, indicating a decrease in sales of the \"milk products and ice cream\" business from 22.7% to 11.0%. However, the actual sales value is not provided for 2023.\n\nTo calculate the sales, we need to know the total sales of Nestl\u00e9 for both 2022 and 2023. Since this information is not provided, we can't accurately calculate the change in ice cream sales from 2022 to 2023.",
        "retrieved_contexts": [
            "We adjusted prices to reflect our own growing costs due to\ninflation. However, we did so responsibly, seeking internal\nefficiencies and cost-saving measures to try to limit price\nincreases. Nestl\u00e9\u2019s role has always been to make nutritious\nfood affordable and accessible to people everywhere,\nand we stay committed to that even in times of economic\nheadwinds. Highlights from 2022 include the following:\n\u2013\nOrganic growth reached 8.3%, with pricing of 8.2%\nand\u00a0real internal growth of 0.1%.\n\u2013\nForeign exchange reduced sales by 0.9%. Net\nacquisitions had a positive impact of 1.1%.",
            "Nestl\u00e9 \u2013 Annual Review 2025\n38\nUnderlying trading operating profit (UTOP) was\nCHF\u00a014.4\u00a0billion, a decrease of 8.4%. UTOP\u00a0margin\nwas 16.1%, a decrease of 110\u00a0bps on a reported\nbasis or 100\u00a0bps in constant currency. The year-on-\nyear decline in UTOP\u00a0margin was primarily driven\nby the impact of input cost inflation on gross profit\nmargin as well as the increase in advertising and\nmarketing expenses and the impact of tariffs, partly\noffset by pricing and cost savings initiatives. Restructuring and net other trading items was\nCHF\u00a01.7\u00a0billion compared to CHF\u00a01.1\u00a0billion in 2024. The increase was mainly driven by impairments,\nlitigation and the allowance for inventory write-offs\ndue to the infant formula recall.",
            "Nestl\u00e9 Annual Review 2022\n38\nmilk products and ice cream\nOffering something\nfor everyone\nOur milk products business delivers nutritional products for all stages\nof life, ambient dairy, plant-based alternatives and coffee creamers. Our ice cream business offers a variety of special treats. At a glance\n11.3\nSales (in CHF\u00a0billion)\n22.7%\nUTOP margin\n12.0%\nPercentage of\nNestl\u00e9\u2019s sales\nNescaf\u00e9 Gold Cappuccino\nIce Cream\nPiloted in Malaysia with an\neye toward further rollout, this\nrefreshing new way to indulge\nNescaf\u00e9 Gold Cappuccino\nuses Nescaf\u00e9 Gold coffee in\nthe innovative soft coating\nand the ice cream. Molico Multigold\nLaunched in Brazil, this\nmulti-benefit product is\nrich in calcium for bones,\ncollagen for joints, fiber\nfor gut health, protein for\nmuscles, and vitamins and\nminerals for immunity. Starbucks Zero Creamer\nThis new zero\u2013added sugar\ncreamer option \u2013 in Caramel\nMacchiato and Hazelnut\nLatte flavors \u2013 addresses\nthe consumer-driven trend\ntoward sugar reduction,\nwithout compromising\non taste.",
            "In 2022, we announced plans to update our Marketing\nCommunication to Children Policy with a commitment\nnot to\u00a0market confectionery, ice cream or water-based\nbeverages with added sugars to children aged under\n16\u00a0years. This will meet the strictest standard in the industry. In 2022, we also announced plans to update our policy on\nthe responsible marketing of breast milk substitutes, with\na commitment to\u00a0unilaterally stop the promotion of infant\nformula globally for babies aged 0\u00a0to\u00a06\u00a0months. Product quality and food safety\nQuality and safety for consumers is Nestl\u00e9\u2019s top priority. This applies to our entire portfolio, from foods and\nbeverages to systems and services.",
            "Nestl\u00e9 Annual Review 2023\n26\nmilk products and ice cream\nResponding to\nevolving preferences\nAt a glance\n11.0\nSales (in CHF\u00a0billion)\n24.5%\nUTOP margin\n11.8%\nPercentage of\nNestl\u00e9\u2019s sales\nOur milk products business delivers nutritional products for all stages\nof life, ambient dairy, plant-based alternatives and coffee creamers. Our ice cream business offers a variety of special treats. KitKat Pink\nLaunched in Malaysia with\nplans for global rollout,\nthe new KitKat Pink\nstrawberry cheesecake-\nflavored ice cream bar is\nsuccessfully addressing\nrising demand for\nunique cross-category\nbrand extension. Yiyang JiaHeng\nThe new Yiyang JiaHeng\nmilk powder supports\nhealthy aging in China\nby delivering comprehensive\nnutrition for seniors in each\nserving, helping to maintain\nimmunity, mobility and\ncardiovascular health. Starbucks Vanilla Creamer\nInspired by the popular\nStarbucks Vanilla Latte\nserved at Starbucks stores,\nthis highly anticipated\nlaunch continues to support\nthe growing demand for\nStarbucks coffee enhancers\nin the U.S. market."
        ],
        "reference": "They decreased from CHF 930 million in 2022 to CHF 889 million in 2023.",
        "faithfulness": 0.3333333333333333,
        "answer_relevancy": 0.9016247041807341,
        "context_recall": 0.0,
        "context_precision": 0.0
    },
    {
        "user_input": "How did the mitigation strategy for \"Environmental stewardship\" regarding water change from 2021 to 2023?",
        "response": "There is no information provided about any \"mitigation strategy for 'Environmental stewardship' regarding water\" in the given context. The information provided is about Nestl\u00e9's approach to addressing climate change, including their risk assessment, net zero pledge, and mitigation plans for climate-related risks. There is no specific mention of water management or a mitigation strategy for water.",
        "retrieved_contexts": [
            "At operational level, an ESG Strategy and Deployment Unit\ndrives implementation. Strategy\nStrategy / Risk Management\nClimate-related risks and opportunities\nClimate change is considered a material risk for Nestl\u00e9. Within our\nEnterprise Risk Management framework, we conduct an annual\nassessment of climate change risks and review the strategy and plans\nto\u00a0mitigate them. We assess related financial risks using a discounted\ncash flow methodology. Our assessment establishes:\n\u2013\nTransition risks: we have assessed transition risks to 2030, based on\nexposure levels from low-, medium- and high-emission pathways.",
            "Addressing climate change\nNestl\u00e9 recognizes both the risks climate change poses to\nits business and the opportunities for companies willing\nto take decisive action. This is why we made our net zero\npledge. We have identified climate-related risks, including\nsupply constraints; policy changes such as increased\ncarbon taxes, land-use restrictions and agricultural\nsubsidy shifts; and increased public concern affecting\nour reputation. As more than 70% of our direct and indirect GHG\nemissions occur in our agricultural supply chain, our\nprimary focus is on the physical risks facing producers. Based on a decade of work, we are building robust\nmitigation and adaptation plans to improve supply chain\nresilience.",
            "We faced a choice this past year in how to react to these\nchallenges. There was little handwringing as it was clear to\nus that we could not lose sight of our long-term strategy:\nwe continued to invest in R&D, our brands and sustainability\ninitiatives. Increased food insecurity only strengthened\nNestl\u00e9\u2019s commitments to maintaining essential food\nsupplies, providing affordable nutrition and advancing\nregenerative food systems. To stay on course required a constant rebalancing between\ngrowth, affordability, and meeting our commitments to\nshareholders and other stakeholders. There were no easy\nsolutions, but we did not waver in our resolve to deliver\non short-term expectations, progress on our long-term\nambitions and remain true to the core of our strategy: Good\nfor You, Good for the Planet.",
            "In 2021, we increased the number of\nglobal/multi-market launches and test launches by 12%. Coffee. From the way coffee is grown and produced to\nhow it is consumed, we are innovating for better consumer\ncoffee experiences and improved livelihoods for farmers. Nestl\u00e9\u2019s plant scientists announced a major breakthrough\nin 2021 by discovering two new Robusta varieties with up to\n50% higher yields per tree versus standard varieties along\nwith lower carbon emissions. Harnessing Nestl\u00e9\u2019s unique\nexpertise in roasting technology, the new Nescaf\u00e9 Gold Blend\nRoastery Collection is a super-premium barista-style soluble\ncoffee.",
            "Nestl\u00e9 \u2013 Annual Review 2024\n55\nleadership transition. Our Sustainability Committee\nadvises on our environmental and social sustainability,\nincluding our response to climate change and our human\nrights due diligence program, as well as the structure\nand content of our non-financial reporting. The Audit\nCommittee oversees internal and external audit and\nreviews reports regarding internal controls, compliance,\nfraud and risk management, as well as the accuracy of\nour financial and non-financial reporting. The Nomination\nCommittee, chaired by our Lead Independent Director,\nevaluates Board composition, performance, structure\nand succession planning, and assesses candidates for\nnomination to the Board. The Compensation Committee\nensures alignment of our remuneration systems with our\nvalues, strategies and performance."
        ],
        "reference": "It shifted from a \"Context-based approach to water resource management\" in 2021 to a \"Caring for Water plan to implement water stewardship initiatives\" in 2023.",
        "faithfulness": 1.0,
        "answer_relevancy": 0.6810614193663563,
        "context_recall": 0.0,
        "context_precision": 0.0
    },
    {
        "user_input": "How did the Underlying trading operating profit fluctuate from 2021 to 2023? Give me all three years.",
        "response": "However, based on the provided context, we have data for 2020 and 2021.\n\nFor 2020 and 2021:\n- 2020: Underlying trading operating profit - CHF 12 159 million\n- 2021: Underlying trading operating profit - CHF 14 903 million\n\nThis data does not extend to 2023.",
        "retrieved_contexts": [
            "The\nunderlying tax rate decreased by 40\u00a0basis points to 20.7%,\nmainly due to the geographic and business mix. Underlying trading operating profit and Trading operating profit\nIn millions of CHF\nIn % of sales\nUnderlying trading operating profit\nTrading operating profit\n2020\n2020\n2021\n2021\n15 119\n12 159\n17.4%\n14.0%\n14 903\n14 233\n17.7%\n16.9%\nUnderlying trading operating\nprofit by operating segment\nIn % of sales\nTrading operating profit\nby operating segment\nIn % of sales\nZone AMS\nZone EMENA\nZone AOA\nNespresso\nNestl\u00e9 Health Science\n21.8%\n18.5%\n20.8%\n23.0%\n13.6%\n11.9%\n17.9%\n19.5%\n22.7%\n13.0%",
            "As a result, trading operating profit\nincreased by 8.5% to CHF\u00a013.2\u00a0billion and the\ntrading operating profit margin was unchanged\nversus the prior year on a reported basis at 14.0%. Underlying trading operating\nprofit by operating segment\nIn % of sales\nTrading operating profit\nby operating segment\nIn % of sales\nZone NA\nZone EUR\nZone AOA\nZone LATAM\nZone GC\nNespresso\nNestl\u00e9 Health Science\n21.0%\n18.6%\n21.2%\n20.3%\n16.4%\n14.2%\n16.1%\n15.7%\n13.6%\n-9.0%\n22.9%\n22.4%\n21.5%\n20.3%\nUnderlying trading operating profit and Trading operating profit\nIn millions of CHF\nIn % of sales\nUnderlying trading operating profit\nTrading operating profit\n2021\n2021\n2022\n2022\n17.1%\n13\u2009195\n14.0%\n15\u2009119\n16\u2009103\n12\u2009159\n17.4%\n14.0%",
            "Nestl\u00e9 Annual Review 2021\n59\nNestl\u00e9 Health Science (a)\nIn millions of CHF\n2020\n2021\nRIG (%)\nOG (%)\nTotal sales\n3 326\n4 822\n+13.4%\n+13.5%\nUnderlying trading operating profit\n549\n654\n13.6%\nTrading operating profit\n534\n628\n13.0%\nCapital additions\n4 833\n6 594\n136.8%\n(a)  See Foreword on page 46. Nestl\u00e9 Health Science\nSales\nCHF 4.8 billion\nOrganic growth\n+13.5%\nReal internal growth\n+13.4%\nUnderlying trading operating profit margin\n13.6%\nUnderlying trading operating profit margin\n\u2013290 basis points\nTrading operating profit margin\n13.0%\nTrading operating profit margin\n\u2013300 basis points\n\u2013 13.5% organic growth: 13.4% RIG; 0.1% pricing.\n\u2013 The underlying trading operating profit margin decreased\nby 290 basis points to 13.6%. Organic growth was 13.5%, with strong RIG of 13.4% and\n0.1% pricing. Net acquisitions increased sales by 33.2%,\nlargely related to the acquisitions of the core brands of The\nBountiful Company, Vital Proteins, Zenpep and Aimmune. Foreign exchange negatively impacted sales by 1.8%.",
            "Nestl\u00e9 Annual Review 2021\n58\nNespresso\nSales\nCHF 6.4 billion\nOrganic growth\n+8.8%\nReal internal growth\n+8.2%\nUnderlying trading operating profit margin\n23.0%\nUnderlying trading operating profit margin\n\u201360 basis points\nTrading operating profit margin\n22.7%\nTrading operating profit margin\n\u201390 basis points\nNespresso (a)\nIn millions of CHF\n2020\n2021\nRIG (%)\nOG (%)\nTotal sales\n5 885\n6 418\n+8.2%\n+8.8%\nUnderlying trading operating profit\n1 392\n1 475\n23.0%\nTrading operating profit\n1 390\n1 456\n22.7%\nCapital additions\n275\n445\n6.9%\n(a)  See Foreword on page 46.\n\u2013 8.8% organic growth: 8.2% RIG; 0.6% pricing.\n\u2013 The underlying trading operating profit margin decreased\nby 60 basis points to 23.0%. Organic growth reached 8.8%, based on strong RIG of 8.2%\nand pricing of 0.6%. Foreign exchange positively impacted\nsales by 0.3%. Reported sales in Nespresso increased by\n9.1% to CHF\u00a06.4\u00a0billion. Nespresso posted high single-digit growth, moderating to a\nmid single-digit rate in the second half following a high base\nof comparison in 2020.",
            "Nestl\u00e9 Annual Review 2021\n48\nUnderlying trading operating profit\nUnderlying trading operating profit increased by 1.4% to\nCHF\u00a015.1\u00a0billion. The underlying trading operating profit\nmargin decreased by 30\u00a0basis points to 17.4% in constant\ncurrency and on a reported basis, reflecting time delays\nbetween cost inflation and pricing actions. The one-off\nintegration costs related to the acquisition of The Bountiful\nCompany\u2019s core brands had a negative impact of around\n10\u00a0basis points. Gross margin decreased by 130\u00a0basis points to 47.8%,\nreflecting significant broad-based inflation for commodity,\npackaging, freight and energy costs. The impact of cost\ninflation, which increased strongly in the second half,\nwas partly offset by price increases, operating leverage\nand efficiencies."
        ],
        "reference": "It was CHF 15,119 million in 2021, rose to CHF 16,103 million in 2022, and dipped slightly to CHF 16,053 million in 2023.",
        "faithfulness": 0.75,
        "answer_relevancy": 0.8314204496878904,
        "context_recall": 0.0,
        "context_precision": 0.0
    },
    {
        "user_input": "Compare the Organic Growth percentage for the CHF 19.1 billion sales zone in 2022 versus 2023.",
        "response": "Based on the provided context, the Organic Growth percentage for the CHF 19.1 billion sales zone in 2022 is +7.2%. However, the Organic Growth percentage is not directly available for 2023 for the Zone Europe (EUR).\n\nHowever, a segment performance summary is available for 2023, but it is for Zone Europe (EUR) and not specifically the CHF 19.1 billion sales zone. According to the segment performance summary, the organic growth for Zone Europe (EUR) in 2023 was 3.2%.",
        "retrieved_contexts": [
            "Nestl\u00e9 Annual Review 2022\n54\nSales\nCHF 19.1 billion\nOrganic growth\n+\u20097.2%\nReal internal growth\n+\u20090.9%\nUnderlying trading operating profit margin\n16.4%\nUnderlying trading operating profit margin\n\u2013\u2009190 basis points\nTrading operating profit margin\n14.2%\nTrading operating profit margin\n\u2013\u2009340 basis points\nZone Europe (EUR)\nreported robust growth, led by healthy snacking. Frozen food saw low single-digit growth, with\nrobust sales developments for Hot\u00a0Pockets frozen\nsnacks and DiGiorno\u00a0pizza. Premium water posted\nmid single-digit growth, with a sales decrease\nin the fourth quarter mainly due to temporary\ncapacity constraints. Ready-to-drink Nesquik in\nthe U.S. and KitKat in Canada reported strong\ngrowth, supported by new product launches\nand execution. The Zone\u2019s underlying trading operating profit\nmargin increased by 70\u00a0basis points.",
            "Foreign exchange negatively impacted sales by\n7.6%, reflecting the appreciation of the Swiss franc\nagainst the Euro. Reported sales in Zone Europe\nincreased by 1.8% to CHF 19.1 billion. In a challenging environment, Zone Europe\ndemonstrated resilience and a commitment\nto invest for the long-term. In Ukraine, Nestl\u00e9\nannounced a CHF\u00a040\u00a0million investment for a new\nproduction facility in the Volyn region. The Zone saw market share gains in\nconfectionery, pet food and Infant Nutrition.",
            "Reported sales in Zone Europe\ndecreased by 0.2% to CHF\u00a019.1\u00a0billion. Growth in Zone Europe was supported by pricing,\nstrong sales development for e-commerce and\ncontinued momentum for out-of-home channels. The Zone saw market share gains in pet food and\nInfant Nutrition. By product category, the key contributor to growth\nwas Purina PetCare, driven by differentiated\nofferings across premium brands Felix, Gourmet\nand Purina ONE. Coffee saw mid single-digit\ngrowth, led by Nescaf\u00e9 soluble and ready-to-\ndrink products.",
            "Culinary posted\nmid single-digit growth, with robust sales\ndevelopments for Maggi and Thomy. Water saw\nlow single-digit growth, as strong momentum for\nS.Pellegrino and Acqua Panna was largely offset\nby the impact of temporary capacity constraints\nfor Perrier. Sales\nCHF 19.1 billion\nOrganic growth\n+\u20098.2%\nReal internal growth\n\u2013\u20092.4%\nUnderlying trading operating profit margin\n16.4%\nUnderlying trading operating profit margin\n0 basis point\nTrading operating profit margin\n14.1%\nTrading operating profit margin\n\u2013\u200910 basis points\nZone Europe (EUR)",
            "Segment performance summary for 2025\n\u2013 Organic growth was 3.2%, with 0.8% RIG and\n2.5% pricing.\n\u2013 Reported sales were down versus the prior year\nat CHF\u00a020.6\u00a0billion, due to the negative impact\nof\u00a05.8% from foreign exchange movements.\n\u2013 In Zone AOA excluding Greater China, organic\ngrowth was 6.1%, with 2.3% RIG and 3.8%\npricing. In Greater China, organic growth was\n\u2013\u20096.4%, with \u2013\u20094.5% RIG and \u2013\u20091.9% pricing."
        ],
        "reference": "It improved from +7.2% in 2022 to +8.2% in 2023.",
        "faithfulness": 0.4,
        "answer_relevancy": 0.9185614060913208,
        "context_recall": 1.0,
        "context_precision": 0.0
    },
    {
        "user_input": "Compare the total sales for \"Milk products\" specifically (excluding ice cream) between 2021 and 2023.",
        "response": "Unfortunately, the provided text does not directly provide the total sales for \"Milk products\" specifically for 2023. However, it does provide the total sales for \"Milk products and Ice cream\" for 2023, which is 10,700 million CHF. \n\nTo find the total sales for \"Milk products\" specifically, we need to subtract the sales for \"Ice cream\" from the total sales for \"Milk products and Ice cream\". The sales for \"Ice cream\" in 2021 was 920 million CHF, and in 2023, it was 922 million CHF. \n\nUsing 2021 sales, the calculation would be:\n10,087 (Milk products) - 920 (Ice cream) = 9,167 million CHF\n\nUsing 2023 sales, the calculation would be:\n10,700 (Milk products and Ice cream) - 922 (Ice cream) = 9,778 million CHF\n\nHowever, based on the data given in the Nestl\u00e9 Annual Review 2021, \"Milk products\" made up 91.4% of the total sales in the \"Milk products and Ice cream\" segment in 2021, and if we apply the same percentage to the 2023 total sales, we would get:\n10,700 x 91.4% = 9,739 million CHF\n\nIt appears that the total sales for \"Milk products\" specifically increased from 9,167 million CHF in 2021 to 9,778 million CHF in 2023, but if the same percentage is applied, it would be 9,739 million CHF.",
        "retrieved_contexts": [
            "Employees by activity\nIn thousands\n2021\n2022\nFactories\n140\n140\nAdministration and sales\n136\n135\nTotal\n276\n275\nOn November\u00a029, 2022, the Group announced\nthe decision to explore strategic options\nfor Palforzia, the peanut allergy treatment,\nfollowing slower than expected adoption by\npatients and healthcare professionals. The\nreview is expected to be completed in the first\nhalf of 2023. Outlook\n2023 outlook: we expect organic sales growth\nbetween 6% and 8% and underlying trading\noperating profit margin between 17.0% and\n17.5%. Underlying earnings per share in\nconstant currency is expected to increase\nbetween 6% and 10%. 2025 targets fully confirmed: we expect\nsustainable mid single-digit organic sales\ngrowth and a return to an underlying trading\noperating profit margin range of 17.5% to\n18.5% by 2025.",
            "Box of H\u00e4agen-Dazs extr\u00e4az Key Lime Pie, bottle of Coffee mate Dirty Soda Coconut Lime, cannister of Nido School Age and cannister of Yiyang powdered beverage. 24\nNestl\u00e9 \u2013 Annual Review 2024\nYiyang\nYiyang continues to solidify\nits position as a key player\nin\u00a0the healthy aging market\nin China thanks to a portfolio\naddressing senior Chinese\nconsumer needs and\nadvanced nutritional science. H\u00e4agen-Dazs extr\u00e4az\nLaunched in Canada,\nthe new H\u00e4agen-Dazs\nextr\u00e4az flavors are specially\ncrafted to deliver exciting\ntastes and a captivating\nmultisensory experience\nthat appeals to younger\nice cream consumers. Nido School Age\nNido School Age launched\nin Brazil and the Middle East,\nwith nutrients specifically\nselected to support\nkids\u2019 normal cognitive\ndevelopment during the\ncritical school-age period.\nmilk products and ice cream\nProviding options\nfor everyone\nOur milk products business delivers nutritional products for all stages\nof life, ambient dairy, plant-based alternatives and coffee creamers. Our ice cream business offers a variety of special treats.",
            "Nestl\u00e9 Annual Review 2021\n52\nProduct category and operating segment review\nIn millions of CHF\n2020 *\n2021\nProportion of total sales (%)\nRIG (%)\nOG (%)\nPowdered and Liquid Beverages\nSoluble coffee/coffee systems **\n15 842\n17 120\n71.4%\nOther **\n6 414\n6 855\n28.6%\nTotal sales\n22 256\n23 975\n+7.8%\n+8.9%\nUnderlying trading operating profit\n5 035\n5 631\n23.5%\nTrading operating profit\n4 851\n5 406\n22.5%\nWater\nTotal sales\n6 421\n4 040\n+3.0%\n+6.8%\nUnderlying trading operating profit\n639\n364\n9.0%\nTrading operating profit\n522\n257\n6.4%\nMilk products and Ice cream\nMilk products\n10 087\n9 778\n91.4%\nIce cream\n920\n922\n8.6%\nTotal sales\n11 007\n10 700\n+3.0%\n+5.9%\nUnderlying trading operating profit\n2 652\n2 707\n25.3%\nTrading operating profit\n2 615\n2 642\n24.7%\nNutrition and Health Science\nTotal sales\n12 160\n13 157\n+0.4%\n+1.4%\nUnderlying trading operating profit\n2 640\n2 307\n17.5%\nTrading operating profit\n2 490\n243\n1.8%\nPrepared dishes and cooking aids\nFrozen and chilled\n5 694\n5 871\n48.3%\nCulinary and other\n5 829\n6 275\n51.7%\nTotal sales\n11 523\n12 146\n+4.6%\n+6.6%\nUnderlying trading operating profit\n2 171\n2 040\n16.8%\nTrading operating profit\n2 147\n1 931\n15.9%\nConfectionery\nChocolate\n5 265\n5 716\n76.1%\nSugar confectionery\n585\n651\n8.6%\nSnacking and biscuits\n1 125\n1 147\n15.3%\nTotal sales\n6 975\n7 514\n+6.3%\n+7.9%\nUnderlying trading operating profit\n990\n1 205\n16.0%\nTrading operating profit\n874\n1 093\n14.5%\nPetCare\nTotal sales\n14 001\n15 556\n+9.4%\n+12.7%\nUnderlying trading operating profit\n3 081\n3 282\n21.1%\nTrading operating profit\n3 089\n3 241\n20.8%\n*\n2020 comparatives adjusted, see Foreword on page 46.\n** 2020 comparatives adjusted following a new product grouping between Soluble coffee/coffee systems and Other.",
            "Underlying\nearnings per share in constant currency to\nincrease between 6% and 10%. Sales, employees and factories by geographic area\nSales\nEmployees\nFactories\n2022\n2023\n2022\n2023\n2022\n2023\nNA\n34.9%\n35.0%\n14.3%\n14.5%\n57\n56\nEUR (a)\n23.6%\n24.0%\n28.7%\n28.6%\n99\n96\nAOA\n22.2%\n21.4%\n26.2%\n26.0%\n100\n100\nLATAM\n13.1%\n13.7%\n21.9%\n22.1%\n65\n65\nGC\n6.2%\n5.9%\n8.9%\n8.8%\n23\n23\n(a)\t \u00078304 employees in Switzerland in 2023. Employees by activity\nIn thousands\n2022\n2023\nFactories\n140\n134\nAdministration and sales\n135\n136\nTotal\n275\n270",
            "Our pet care portfolio is excluded from\nthis assessment. Looking at people\u2019s diets holistically, we know that\npeople consume food and beverages not only for\nnutrition but also for enjoyment. Nestl\u00e9 aims to offer\nthe right products for all these occasions, while also\nguiding people towards a more balanced diet. We are\nstrengthening our responsible marketing practices, with\nnew rules restricting the marketing to children under the\nage of 16\u00a0years in effect as of July 2023. We are ensuring\nthat all children\u2019s confectionery and ice cream portions\nwill be 110\u00a0kilocalories or less and that all multi-serve\nproducts from these two categories have clear front-\nof-pack portion guidance."
        ],
        "reference": "It increased from CHF 9,778 million in 2021 to CHF 10,092 million in 2023.",
        "faithfulness": 0.45454545454545453,
        "answer_relevancy": 0.7282145687013384,
        "context_recall": 0.0,
        "context_precision": 0.0
    },
    {
        "user_input": "According to the 2023 Principal Risks table, what is the primary mitigation strategy for addressing physical and transitional climate change disruptions?",
        "response": "The Principal Risks table is actually from the 2025 Annual Review, not 2023. However, based on the provided text, the primary mitigation strategy for addressing physical and transitional climate change disruptions is:\n\n- Implementation of Nestl\u00e9\u2019s Net Zero Roadmap, including the Nestl\u00e9 Agriculture Framework and Nestl\u00e9 Responsible Sourcing Core Requirements",
        "retrieved_contexts": [
            "Addressing climate change\nNestl\u00e9 recognizes both the risks climate change poses to\nits business and the opportunities for companies willing\nto take decisive action. This is why we made our net zero\npledge. We have identified climate-related risks, including\nsupply constraints; policy changes such as increased\ncarbon taxes, land-use restrictions and agricultural\nsubsidy shifts; and increased public concern affecting\nour reputation. As more than 70% of our direct and indirect GHG\nemissions occur in our agricultural supply chain, our\nprimary focus is on the physical risks facing producers. Based on a decade of work, we are building robust\nmitigation and adaptation plans to improve supply chain\nresilience.",
            "At operational level, an ESG Strategy and Deployment Unit\ndrives implementation. Strategy\nStrategy / Risk Management\nClimate-related risks and opportunities\nClimate change is considered a material risk for Nestl\u00e9. Within our\nEnterprise Risk Management framework, we conduct an annual\nassessment of climate change risks and review the strategy and plans\nto\u00a0mitigate them. We assess related financial risks using a discounted\ncash flow methodology. Our assessment establishes:\n\u2013\nTransition risks: we have assessed transition risks to 2030, based on\nexposure levels from low-, medium- and high-emission pathways.",
            "In 2021, 27.2% of our top 200+\nsenior executive positions were held\nby women. In January 2022, we\nwere recognized by the Bloomberg\nEquality Index for the fourth\nconsecutive year for advancing the\ngender balance in our workplace. We also work to empower the\nmany women farmers in our supply\nchain with training on good farming\npractices, financial literacy and\nleadership to help them improve\ntheir business, income and financial\nindependence. We offer support\nto help women farmers secure\nbetter access to land, credit and\ninformation, and train our farming\npartners and agronomists in gender awareness to help the\nindustry become more diverse and equitable. Addressing climate change\nNestl\u00e9 recognizes both the risks climate change poses to\nits business and the opportunities for companies willing\nto take decisive action.",
            "Nestl\u00e9 \u2013 Annual Review 2025\n53\nPrincipal risk\u2009*\nDescription\nPotential impact\nKey mitigations\nBusiness\ntransformations\nFailure to successfully execute\nstrategic transformations (such as\nlarge-scale change management\ninitiatives, restructuring programs,\nor mergers and acquisitions)\nor investments (emerging\ntechnologies, new business models,\nnovel categories or geographic\nexpansion)\n\u2013 Failure to realize anticipated\nbenefits\n\u2013 Impairments\n\u2013 Low employee morale and/or\nengagement\n\u2013 Broader exposures for the Group\n\u2013 Acceptance of higher risk and\nreturn metrics\n\u2013 Executive sponsorship of\ntransformations with aligned\ntargets and appropriate levels of\nresources to support successful\nexecution\n\u2013 Group\u2019s investment choices\naligned with strategy and\nprioritized based on the potential\nto create value over the long term\nClimate change\n\u2013 Climate-related physical disruption\n(e.g., increasing frequency and\nseverity of weather events, land\nuse change, deforestation,\nbiodiversity loss, etc.)\n\u2013 Climate-related transitional\ndisruption (e.g., policy actions,\ntechnological advances, market\nsentiment, etc.) disrupting our\noperations and/or consumer\ndemand\n\u2013 Volatility in supply and price of raw\nmaterials due to physical climate\nchanges (e.g., water stress, heat\nstress, etc.)\n\u2013 Policy impacts (e.g., carbon tax,\nland use restrictions, agricultural\nsubsidy shifts, etc.) on operating\ncosts\n\u2013 Increased consumer and/or\nstakeholder concern regarding\nclimate change impacting\nreputation\n\u2013 Implementation of Nestl\u00e9\u2019s Net\nZero Roadmap, including the\nNestl\u00e9 Agriculture Framework and\nNestl\u00e9 Responsible Sourcing Core\nRequirements\n\u2013 Climate scenario modeling aligned\nto TCFD requirements\n\u2013 Progress on mitigation and\nadaptation is reported in the Non-\nFinancial Statement and Nestl\u00e9\u2019s\nCDP questionnaire responses\nConsumer behaviors\n\u2013 Failure to adequately anticipate\nevolving consumer behaviors and\nconsumption habits, particularly\nin addressing health and nutrition\nconcerns\n\u2013 Failure to innovate relevant,\ncompetitive products and brands;\nand/or execute at speed\n\u2013 Negative effect on Nestl\u00e9\u2019s\nreputation and/or brands\n\u2013 Failure to achieve growth targets,\nloss of market share\n\u2013 Nestl\u00e9\u2019s Nutrition, Health and\nWellness (NHW) strategy\n\u2013 Acceleration of consumer-centric\ninnovation\n\u2013 Scientific and nutritional\nknow\u2011how applied to enhance\nnutrition, health and wellness\n\u2013 Improved accessibility of safe and\naffordable food\nCorporate governance\nFailure to comply and/or meet\nexpectations with regards to\nour governance mechanisms,\nprocedures and rules that govern\ndecision-making\n\u2013 Negative effect on Nestl\u00e9\u2019s\nreputation and/or brands\n\u2013 Penalties and/or fines\n\u2013 Litigation\n\u2013 Board oversight supported by\nappropriate committees\n\u2013 Appropriate responsibility and\naccountability levels\n\u2013 Organizational principles\n\u2013 Compliance with laws and\nregulations\nCustomer and channel\nmanagement\nFailure to build and maintain trading\nrelationships across traditional and\nemerging channels\n\u2013 Reduced distribution of our\nproducts to consumers\n\u2013 Restricted ability to price\nimpacting margin\n\u2013 Failure to achieve growth targets,\nloss of market share\n\u2013 Strategic customer relationship\nmanagement\n\u2013 Continued acceleration of digital\ncapabilities and expansion\nof e-commerce and online\ncommunication\nEnvironmental\nFailure to comply with legislation\nor meet expectations concerning\nthe environment (e.g., biodiversity\nimpacts, use of natural resources, air\nemissions, pollution, etc.)\n\u2013 Negative effect on Nestl\u00e9\u2019s\nreputation and/or brands\n\u2013 Corporate fines and/or taxation on\nproducts/categories\n\u2013 License to operate challenges\n(e.g., access to water, etc.)\n\u2013 Litigation\n\u2013 Nestl\u00e9 Environmental\nRequirements (NER) Standard\n\u2013 Nestl\u00e9\u2019s Net Zero Roadmap\n\u2013 Procedures and processes to\ncomply with environmental\nlegislation\n\u2013 Nestl\u00e9 Agriculture Framework\nand Nestl\u00e9 Responsible Sourcing\nCore Requirements to support in\nconservation and restoration of\nbiodiversity and soil health\n\u2013 Commitments to improve\noperational efficiencies (e.g.,\ntransition to renewable energy\nsources, reduction in air\nemissions, etc.)\n*\u2009Listed in alphabetical order",
            "The financial\nreview section has more information on the principal risks to\nour business. In 2021, we tested the use of more data-driven insights\nto supplement the stakeholder interviews. We found that\nclimate change and decarbonization still rank high globally,\nwhile water, human rights and responsible sourcing\nremain significant. We also confirmed that diversity and\ninclusion as well as biodiversity are increasingly important. All topics are covered in our Creating Shared Value and\nSustainability Report."
        ],
        "reference": "The primary mitigation is the implementation of Nestl\u00c3\u00a9's Net Zero Roadmap alongside regenerative agriculture activities.",
        "faithfulness": 1.0,
        "answer_relevancy": 0.9125859045493767,
        "context_recall": 1.0,
        "context_precision": 0.249999999975
    },
    {
        "user_input": "How does the 2024 report describe the goal of its \"end-to-end digitalization\" initiative regarding the supply chain?",
        "response": "There is no mention of the \"end-to-end digitalization\" initiative in the provided text. However, the report does discuss building robust \"mitigation and adaptation plans to improve supply chain resilience\" through various examples, such as:\n\n1. Developing drought-resistant coffee varieties.\n2. Investing in new technologies to increase dairy-farm efficiency while reducing emissions and improving animal welfare.\n3. Assessing physical risks in the value chain using the Taskforce on Climate-related Financial Disclosures (TCFD) framework.\n4. Incorporating water stewardship into the global regenerative agriculture program.\n\nThese efforts aim to improve supply chain resilience in the face of external challenges such as the COVID-19 pandemic, inflation, and global supply chain issues.",
        "retrieved_contexts": [
            "We are on the ground, close to consumers and\ncustomers. We know how to engage with them to improve\nour connections. Our goal is to increase our share of voice\nby making our products highly visible through prime shelf\nspace and higher levels of advertising and marketing.",
            "We take an unbiased, data-driven approach,\nand if a business does not meet these criteria, we\ncreate an action plan for how to move forward. This\nrigorous approach to addressing underperforming\nareas is a critical complement to the prioritization\nof our growth investments in our most promising\nopportunities.\n\u201cOur company\u2019s long history\nis defined by its ability to\nevolve and adapt \u2013 qualities\nthat have enabled us to\nthrive across generations\nand create shared value.\u201d\nStatement\nfrom\u00a0the\u00a0CEO\nDear fellow shareholders,\nAs I reflect on my initial months as CEO of Nestl\u00e9, I am\nboth honored and invigorated by the opportunity to guide\nour remarkable company into a new era. Over my 24 years\nat Nestl\u00e9, I have witnessed firsthand the passion and\ndedication of our people, the deep connection consumers\nhave to our products and brands, and the positive\nimpact we have on communities around the world. Our\ncompany\u2019s long history is defined by its ability to evolve\nand adapt \u2013 qualities that have enabled us to thrive across\ngenerations and create shared value. It is this same\nessence that will continue to guide us forward.",
            "Nestl\u00e9 Annual Review 2022\n2\nStaying the course\nTrue to our values\nAt the start of 2022, the extreme challenges of the COVID-19\npandemic seemed to be waning. There were some supply\nchain challenges as well as inflationary pressures but those\nappeared to be manageable. The unexpected invasion\nof Ukraine at the end of February changed the course of\nthe year. Global supply chain issues proliferated, inflation\nbecame rampant, concerns over energy shortages took hold\nand food insecurity grew. We faced a choice this past year in how to react to these\nchallenges.",
            "Based on a decade of work, we are building robust\nmitigation and adaptation plans to improve supply chain\nresilience. Examples include our work on drought-resistant\ncoffee varieties (see the Powdered and Liquid Beverages\ncase study) and our investment in new technologies to\nincrease dairy-farm efficiency while reducing emissions\nand improving animal welfare. In 2021, we continued to apply the Taskforce on Climate-\nrelated Financial Disclosures (TCFD) framework by\nassessing physical risks in our value chain over a longer\ntime horizon. Details are available in our second TCFD\nreport: www.nestle.com/tcfd-report. We also joined the\nTaskforce on Nature-related Financial Disclosures working\ngroup in 2021, to advance the collective understanding of\nhow to report on risks and dependencies related to the\nnatural environment.",
            "We have already developed action plans tailored to the\nneeds of specific crops, such as cereals, coffee, dairy, sugar\nand tomatoes, in high-priority regions and will work to\nincorporate water stewardship into our global regenerative\nagriculture program. Advancing the regeneration of water cycles\nNestl\u00e9 Waters is investing CHF\u00a0120\u00a0million to assist the\nimplementation of more than 100\u00a0projects to help regenerate\necosystems in the areas around each of its bottling sites. As\nof 2025, these projects will help nature retain more water\nthan the business uses in its operations. In Buxton, a famous British spa town, we are partnering\nwith local stakeholders to come up with practical, natural\ninterventions to help prevent flooding. Our aim is to\nhelp retain more rainwater in the landscape so it does\nnot rush into the river too rapidly and cause flooding."
        ],
        "reference": "The goal is to transmit data across the entire value chain to enable faster decision-making in procurement, manufacturing, and distribution.",
        "faithfulness": 0.8888888888888888,
        "answer_relevancy": 0.6459800275292411,
        "context_recall": 0.0,
        "context_precision": 0.0
    },
    {
        "user_input": "How does the 2025 strategy section characterize the new \"performance culture\" management wants to foster?",
        "response": "The 2025 strategy section does not explicitly mention a \"performance culture,\" but it characterizes the approach to addressing underperforming areas as \"rigorous\" and \"data-driven.\" It also mentions that if a business does not meet certain criteria, an \"action plan\" is created to address how to move forward. This suggests a culture of accountability, transparency, and continuous improvement.",
        "retrieved_contexts": [
            "Nestl\u00e9 \u2013 Annual Review 2025\n24\nEngaging in\ncreative ways\nNestl\u00e9 wants to be present\nat the\u00a0events, on the media\nplatforms and with the pop\nculture figures that consumers\nenjoy. In 2025, our brands found\ncreative avenues for reaching\nnew consumers. Our new partner, Formula 1\u00ae\nNestl\u00e9 launched its biggest global\npartnership ever in 2025. By making\nKitKat\u202fthe Official Chocolate Bar\nof Formula 1\u00ae (F1\u00ae), Nestl\u00e9 gained\nexposure to F1\u00ae\u2019s young and diverse\n(over 40% female) fan base of over\n825\u00a0million people across key markets. The multi-year collaboration will\nstrengthen KitKat\u2019s iconic status\nand further accelerate its growth\nby attracting new shoppers and\nincreasing\u00a0sales.",
            "Guided by materiality\nIn an ever-changing world, we know that stakeholder\npriorities are constantly evolving and that we must\nreevaluate our activities to continue to meet expectations. Every two years, we conduct a comprehensive materiality\nassessment based on stakeholder interviews to identify\nand prioritize the economic, social and environmental\nimpacts that matter most to our business and stakeholders. The analysis helps guide where we focus internal resources\nand the areas covered in our reporting. The assessment is fully integrated with Nestl\u00e9\u2019s Enterprise\nRisk Management process, to ensure wider sustainability\nimpacts are incorporated into the risks and opportunities\nunder consideration across the company. The financial\nreview section has more information on the principal risks to\nour business.",
            "All topics are covered in our Creating Shared Value and\nSustainability Report. This section covers the major material impacts identified\nin our materiality assessment. We cross-referenced these\nareas with the Sustainability Accounting Standards Board\n(SASB) standards for Processed Foods and Non-Alcoholic\nBeverages to ensure coverage of the topics most relevant\nto our investors. We plan to update our materiality\nassessment in full in 2022. Read our Creating Shared Value and Sustainability Report:\nwww.nestle.com/csv-report-2021\nRead more about materiality on our website:\nwww.nestle.com/materiality\nWe are investing\nCHF\u00a01.2\u00a0billion by 2025\nto help farmers adopt\nregenerative practices.",
            "We take an unbiased, data-driven approach,\nand if a business does not meet these criteria, we\ncreate an action plan for how to move forward. This\nrigorous approach to addressing underperforming\nareas is a critical complement to the prioritization\nof our growth investments in our most promising\nopportunities.\n\u201cOur company\u2019s long history\nis defined by its ability to\nevolve and adapt \u2013 qualities\nthat have enabled us to\nthrive across generations\nand create shared value.\u201d\nStatement\nfrom\u00a0the\u00a0CEO\nDear fellow shareholders,\nAs I reflect on my initial months as CEO of Nestl\u00e9, I am\nboth honored and invigorated by the opportunity to guide\nour remarkable company into a new era. Over my 24 years\nat Nestl\u00e9, I have witnessed firsthand the passion and\ndedication of our people, the deep connection consumers\nhave to our products and brands, and the positive\nimpact we have on communities around the world. Our\ncompany\u2019s long history is defined by its ability to evolve\nand adapt \u2013 qualities that have enabled us to thrive across\ngenerations and create shared value. It is this same\nessence that will continue to guide us forward.",
            "When there are parts of our portfolio that are\nunderperforming, we take steps to address the issues. We are reorganizing our waters business so that, as of\n2025, our water and premium beverages activities will\noperate as a standalone business to better drive the\nspecifics of this category. Under this new structure the\nmanagement team will evaluate the strategy for this\nsegment of our portfolio, including exploring partnership\nopportunities, to enable Nestl\u00e9\u2019s leading water brands\nand growth platforms to achieve their full potential. Fewer, bigger and better global launches. Our R&D\nteams are able to quickly adapt to trends and capture\nnew opportunities."
        ],
        "reference": "It emphasizes clear accountabilities, rewarding winning, and valuing speed over perfection, collaboration over consensus, and courage over comfort.",
        "faithfulness": 0.5,
        "answer_relevancy": 0.9026323791936657,
        "context_recall": 0.0,
        "context_precision": 0.0
    },
    {
        "user_input": "What is the strategic narrative around cold coffee innovation in the 2024 report?",
        "response": "The strategic narrative around cold coffee innovation in the 2024 report is that Nestl\u00e9 is capitalizing on the growing demand for cold coffee, particularly among Gen Z and Millennials, by introducing a broad and complementary portfolio of innovative products under its leading brands. This trend is driven by consumers experimenting and recreating their favorite coffee drinks at home or on-the-go, with cold coffee playing an increasingly important role.\n\nThe report highlights that social media is a key space for people to share their recipes and enjoy coffee as a daily ritual. Nestl\u00e9 is meeting this trend with several innovative products, such as Nescaf\u00e9 Espresso Concentrate, Nescaf\u00e9 Ice Roast instant coffee, and Nespresso Sunny Almond Vanilla Over Ice, which are designed to empower consumers to create caf\u00e9-style cold coffee at home.\n\nThe report emphasizes that cold coffee is becoming a key growth area for Nestl\u00e9, with 1/5 cups of coffee worldwide enjoyed cold. To meet this demand, Nestl\u00e9 is increasing its supply of Nescaf\u00e9 Espresso Concentrate with a new production line in Malaysia and employing innovative techniques such as freeze-drying to develop premium soluble coffee that dissolves in cold liquids.\n\nOverall, the strategic narrative is that Nestl\u00e9 is focused on enhancing its brand desirability and cultural relevance, particularly among younger generations, by introducing innovative products that meet their preferences and habits.",
        "retrieved_contexts": [
            "Nestl\u00e9 is meeting the trend with\nseveral innovative products. The new\nNescaf\u00e9 Espresso Concentrate is the\nultimate cold coffee hack for creating\nbarista-style coffees at home using\nthe premium liquid concentrate. The\nproduct was rolled out in Australia,\nNew Zealand and China in 2024, with\nlaunches planned in North America,\nthe\u00a0UK, Japan and Thailand in 2025. The product complements other cold\nlaunches: Nescaf\u00e9 Ice Roast instant\ncoffee dissolves quickly in any cold\nliquid. Mixing cold with a trendy flavor,\nNespresso Sunny Almond Vanilla Over\nIce was the hero of the 2024 summer,\ncontributing to strong Vertuo cold\ngrowth.",
            "Mixing cold with a trendy flavor,\nNespresso Sunny Almond Vanilla Over\nIce was the hero of the 2024 summer,\ncontributing to strong Vertuo cold\ngrowth. And ready-to-drink cold coffee\nin several geographies targets young\nconsumers\u2019 on-the-go lifestyles. 1/5\ncups of coffee\nworldwide are\nenjoyed cold",
            "Nestl\u00e9 \u2013 Annual Review 2025\n15\nUpping capacity to meet demand\nTo meet the growing demand for\ncold coffee throughout Asia, Nestl\u00e9\nis increasing the supply of its Nescaf\u00e9\nEspresso Concentrate with a new state-\nof-the-art, digitally enabled production\nline at its Sri Muda factory in Malaysia. This first Nestl\u00e9 coffee concentrate\nproduction line in Asia will benefit from\nproximity to coffee sourcing locations\nand enable faster regional distribution. Rapid innovation to meet the moment\nNestl\u00e9 leads the way in coffee\nR&D with proprietary technology,\nglobal reach and consumer-driven\ninnovation. In addition to developing\nthe great-tasting, shelf-stable espresso\nconcentrate, Nestl\u00e9 R&D teams\ndeveloped an innovative freeze-drying\ntechnique that allows premium soluble\ncoffee to dissolve in cold liquids while\ndelivering a smooth, rich flavor. Nestl\u00e9\u2019s freeze-drying\ninnovation was recently\nemployed in Nescaf\u00e9 Iced\nBlend, launched in Japan.",
            "D\n13\nNestl\u00e9 \u2013 Annual Review 2024\nSatisfying the growing\ndemand for cold coffee\nOUR VOICES\n\u201cNescaf\u00e9 Espresso Concentrate\nallows our consumers to make\ntheir favorite iced coffee in\nwhatever way they like \u2013\nimagination is the only limit.\u201d\nDon Howat\nGlobal Lead Nescaf\u00e9\nSwitzerland\nIN FIGURES\nCold coffee is increasingly the\ncoffee drink of choice, especially\namong Gen\u00a0Z and Millennials. We are capitalizing on this fast-\ngrowing opportunity with a broad\nand complementary portfolio of\ninnovative products under our\nleading brands, empowering\nconsumers to create caf\u00e9-style\ncold coffee at home. Inspired by the coffee shop experience,\nconsumers are experimenting and\nrecreating their favorite coffee drinks\nfor at home or on-the-go, with cold\ncoffee playing an important and\ngrowing role. Social media offers a\nspace for people to share their recipes,\nas creating and enjoying coffee\nbeverages is becoming a pleasurable\ndaily ritual for more and more people. Nestl\u00e9 is meeting the trend with\nseveral innovative products.",
            "Nestl\u00e9\u2019s freeze-drying\ninnovation was recently\nemployed in Nescaf\u00e9 Iced\nBlend, launched in Japan. Cold is the new hot\nOur 2025 Nespresso summer campaign\nperfectly illustrates our focus on\nenhancing brand desirability and\ncultural relevance, particularly for\nyounger generations who prefer\ncoffee cold. From on-trend pistachio-\nflavored cold coffee recipes to the\nTikTok\u2013sensation Nespresso Tumbler,\nthe summer campaign embodies our\nstrategy of engaging new audiences\nthrough products they love, meeting\nthem where they are. We launched\nthe campaign during the International\nFilm Festival in Cannes, where our\nNespresso beach became a vibrant hub\nfor celebrities, influencers and content\ncreators, creating the buzz sought in\nthis successful campaign."
        ],
        "reference": "The strategy capitalizes on Gen Z and Millennial trends by empowering consumers to create caf\u00c3\u00a9-style cold coffee at home using innovations like Nescaf\u00c3\u00a9 Espresso Concentrate.",
        "faithfulness": 0.8947368421052632,
        "answer_relevancy": 0.9112735224136203,
        "context_recall": 1.0,
        "context_precision": 0.7499999999625
    },
    {
        "user_input": "What was the exact operating margin for Danone's specialized nutrition division in 2023 compared to Nestl\u00c3\u00a9's?",
        "response": "The information provided does not mention Danone's specialized nutrition division. It only discusses Nestle's performance and mentions Purina, which is a Nestle brand. Therefore, Danone's exact operating margin for its specialized nutrition division in 2023 is not available based on the given context.",
        "retrieved_contexts": [
            "Nestl\u00e9 \u2013 Annual Review 2025\n38\nUnderlying trading operating profit (UTOP) was\nCHF\u00a014.4\u00a0billion, a decrease of 8.4%. UTOP\u00a0margin\nwas 16.1%, a decrease of 110\u00a0bps on a reported\nbasis or 100\u00a0bps in constant currency. The year-on-\nyear decline in UTOP\u00a0margin was primarily driven\nby the impact of input cost inflation on gross profit\nmargin as well as the increase in advertising and\nmarketing expenses and the impact of tariffs, partly\noffset by pricing and cost savings initiatives. Restructuring and net other trading items was\nCHF\u00a01.7\u00a0billion compared to CHF\u00a01.1\u00a0billion in 2024. The increase was mainly driven by impairments,\nlitigation and the allowance for inventory write-offs\ndue to the infant formula recall.",
            "In\u00a02025, organic\nsales growth is expected to improve compared\nto 2024, strengthening through the year as we\ncontinue to deliver on our growth plans. UTOP\nmargin is expected to be at or above 16.0% as we\ninvest for growth. Guidance assumes no significant\nchange in key macroeconomic variables. Our objective remains to deliver superior,\nsustainable and profitable growth. In the medium\nterm, we continue to expect organic sales growth\nto be at 4% plus in a normal operating environment,\nwith an underlying trading operating profit margin\nat 17.0% plus.",
            "Providing transparent information about our products is\ncentral to maintaining people\u2019s trust. In 2022, for the first\ntime, we benchmarked our entire global portfolio against\nthe Health Star Rating (HSR) system, a nutrient profiling\nsystem used by the Access to Nutrition Initiative and\non front-of-pack labels in some countries. We are also\nreporting separately on specialized nutrition products like\ninfant foods and medical nutrition, which are not covered\nby the HSR system. Nestl\u00e9 is the first company to disclose\nthe nutritional value of its entire portfolio, ranging from\noccasional treats to nutritious foods and beverages for daily\nconsumption, to our specialized nutrition offerings. Uncle Tobys Oat Milk\nrange in Australia\nis made with 100%\nAustralian oats and has\na\u00a0Health Star Rating of\nfour out of five.",
            "Nestl\u00e9 Annual Review 2023\n21\nIN FIGURES\nPet owners are increasingly choosing\nto customize their pet\u2019s nutrition with\nsupplements, toppers and snacks that\ncater to their pet\u2019s individual needs. Purina is responding to this shift\nin consumer habits with additional\nhealth-focused nutrition options. Purina Pro Plan Veterinary Supplements\nare specialized supplements for dogs\nand cats, designed to support their\nhealth and address specific conditions. Digestive disorders are common\nhealth issues for pets, varying from\nminor upset stomachs to more\nsevere gastrointestinal problems\nor food allergies. Purina Pro Plan\nVeterinary Supplements FortiFlora is\nthe #1 U.S. recommended probiotic\nby veterinarians.",
            "The average cost of net\ndebt was 2.6% in both 2025 and 2024. The Group reported tax rate was 24.6%,\ncompared to 25.0% in the prior year. The decrease\nwas due to lower one-off tax charges compared to\n2024. The underlying tax rate was 22.1%, compared\nto 21.9% in the prior year. Net profit and Earnings per share\nNet profit decreased by 17.0% to CHF\u00a09.0\u00a0billion."
        ],
        "reference": "This data does not exist in the corpus. The system must gracefully decline to answer as competitor specific operating margins are not provided in Nestl\u00c3\u00a9's Annual Reviews.",
        "faithfulness": 1.0,
        "answer_relevancy": 0.0,
        "context_recall": 1.0,
        "context_precision": 0.0
    },
    {
        "user_input": "Provide the raw Python source code for the proprietary nutritional algorithm used by Tails.com mentioned in the 2021 report.",
        "response": "I can't provide you with the raw Python source code for the proprietary nutritional algorithm used by Tails.com as it's not publicly available. The text provided only mentions that it's developed by vets, nutritionists, and software engineers but does not include the source code.\n\nHowever, I can suggest some possible approaches to build a nutritional algorithm in Python:\n\n1. Use existing libraries and frameworks:\n   - You can use libraries like scikit-learn, pandas, and NumPy to build a machine learning model that can predict nutritional values based on various input parameters.\n\n2. Consult publicly available resources:\n   - You can look for open-source code repositories on platforms like GitHub or GitLab that provide examples of nutritional algorithms.\n\n3. Develop your own algorithm:\n   - You can start by researching the nutritional requirements for different species and breeds of pets. Then, you can develop a custom algorithm that takes into account these requirements, along with other factors like age, weight, and activity level.\n\nHere's a simple example of how you might structure a nutritional algorithm in Python:\n\n```python\nimport pandas as pd\nfrom sklearn.ensemble import RandomForestClassifier\nfrom sklearn.model_selection import train_test_split\n\n# Load data (assuming it's stored in a CSV file)\ndata = pd.read_csv('nutrition_data.csv')\n\n# Define input parameters (e.g., age, weight, activity level)\ninput_params = ['age', 'weight', 'activity_level']\n\n# Define output parameters (e.g., protein, fat, carbohydrates)\noutput_params = ['protein', 'fat', 'carbohydrates']\n\n# Split data into training and testing sets\nX_train, X_test, y_train, y_test = train_test_split(data[input_params], data[output_params], test_size=0.2, random_state=42)\n\n# Train a machine learning model (e.g., random forest)\nmodel = RandomForestClassifier(n_estimators=100, random_state=42)\nmodel.fit(X_train, y_train)\n\n# Use the trained model to make predictions\npredictions = model.predict(X_test)\n```\n\nPlease note that this is a highly simplified example and would likely need to be modified and expanded to suit the specific requirements of a proprietary nutritional algorithm like the one used by Tails.com.",
        "retrieved_contexts": [
            "Nestl\u00e9 Annual Review 2021\n24\n51%\nof total media spend\non digital media\n>18%\nincrease in 1st party\nconsumer data records\n7.4%\nincrease in direct-to-\nconsumer e-commerce\n100+\nconnected factories\nTails.com\nTails.com is powered by a proprietary\nnutritional algorithm developed by vets,\nnutritionists and software engineers to offer\npersonalized pet nutrition through direct-to-\nconsumer subscription and home delivery. Transforming through\ndigitalization",
            "To help address\nthis challenge, Nestl\u00e9 is accelerating\nits efforts to develop more affordable\nnutrition products that contain\nessential vitamins and minerals. The unique and proprietary iron\nsource is based on Ferri-Pro, a\ntechnology originally developed by\nRiddet Institute at Massey University\nin New Zealand \u2013 acquired by Nestl\u00e9\nin January 2019. After acquiring the\ntechnology, Nestl\u00e9 R&D continued to\nwork with Massey University to bring\nthe new source of iron to the market. The result is Iron+. The Nestl\u00e9 Dairy teams in Pakistan\nand Switzerland, supported by\nthe Nestl\u00e9 R&D Center for Dairy\nin Konolfingen, Switzerland,\nsuccessfully launched the innovative\nIron+ in the affordable nutrition\nbrand Bunyad in 2022.",
            "In 2022, we provided 129.2\u00a0billion fortified servings of\naffordable nutrition products. Good for You. In 2022, we made a commitment to increase\nthe transparency of the nutritional value of our global\nportfolio. For the first time, we benchmarked our entire\nglobal portfolio against the Health Star Rating (HSR) system\n\u2013 a nutrient profiling system used by the Access to Nutrition\nInitiative \u2013 and have given an overview of our wide range\nof specialized nutrition products, which are not covered by\n\u201cFor decades, our activities and\nproducts have aimed to make a positive\ndifference to society in order to foster\nNestl\u00e9\u2019s ongoing success. We\u00a0have not\nwavered in that commitment in the\nface of short-term challenges this year.\u201d\nthe HSR system.",
            "Nestl\u00e9 \u2013 Annual Review 2025\n19\nReal food for patients\nNestl\u00e9 Health Science supports patients\nwho cannot consume food orally and\nrely on medical nutrition to help them\nimprove their quality of life. Witnessing\nthe evolving preferences of patients and\ncaregivers for familiar food ingredients\nand plant-based alternatives, we\ncombined expertise in nutrition and\nscientific innovation to provide nature-\ninspired medical nutrition with Compleat\nreal food tube-feeding solutions. In the United States, strong\nrelationships with healthcare providers\nwho prescribe or recommend the\nproduct to patients and caregivers,\ncombined with new marketing\ninvestments and strategies, are paying\noff. Sales of Compleat in 2025 are up\nby\u00a0about one-third thanks to optimizing\nmarketing, launching medical-\ncommunity campaigns, adding about 50\nnew caregiver and patient influencers,\nand leveraging other innovative digital\ncommunications targeting healthcare\nprofessionals and consumers. Whatever your gold\u2026\nThe mission of Solgar has remained\nthe same since 1947: to create the\nfinest nutritional supplements in\nsmall batches, made possible through\ntireless research, using only the finest\nraw materials.",
            "It was first used in Bunyad\nIron+, an affordable dairy-based drink to address iron\ndeficiency in children in Pakistan, with more products\nto follow. Breakthrough technology for sugar reduction\nOffering healthier choices as part of a balanced diet is a\npriority for us. Our new proprietary technology reduces sugar\nin key raw materials, with no impact on taste or texture, for\ndifferent types of products. Based on fermentation, the technology significantly reduces\nsugar in malt and milk, while generating prebiotic fibers. We\nintroduced sugar-reduced Milo in South-East Asia, Africa\nand Oceania, with other product categories and geographies\nto follow."
        ],
        "reference": "This data does not exist in the corpus. The system must decline to answer because proprietary source code is never disclosed in these corporate annual reports.",
        "faithfulness": 0.09090909090909091,
        "answer_relevancy": 0.9530830220733287,
        "context_recall": 0.5,
        "context_precision": 0.9999999999
    },
    {
        "user_input": "What is the precise chemical formulation and ingredient ratio for the Garden Gourmet Sensational Crispy Mini Filet launched in 2022?",
        "response": "There is no information available on the precise chemical formulation and ingredient ratio for the Garden Gourmet Sensational Crispy Mini Filet launched in 2022 in the provided context.",
        "retrieved_contexts": [
            "Nestl\u00e9 Annual Review 2022\n6\n10.8%\ngrowth in affordable\nnutrition products\n7.4%\ngrowth in premium\nproducts\n9.2%\norganic growth\nin e-commerce\n~22%\nof portfolio rotated\n2017-2022\nGarden Gourmet Sensational Crispy Mini Filet\nIn 2022, we continued to expand the plant-based\nfood options within our Garden Gourmet brand,\nsuch as the new 2.0 Sensational Crispy Mini Filet. Generating value\nthrough our strategy",
            "Nestl\u00e9 Annual Review 2023\n8\nGarden Gourmet Marine-Style Crispy Filet\nOur Garden Gourmet Marine-Style Crispy\nFilet launched in several European countries\nin\u00a02023, expanding the range of plant-based\nfish alternatives, which includes the popular\nGarden Gourmet Vuna. Implementing\nour growth strategy",
            "The increased\nuse of vegetables and legumes creates\ngreater nutritional value. In 2022, we continued to expand the\nplant-based options within our Garden\nGourmet brand, such as the new\nchicken alternative, Sensational Crispy\nMini Filet. Beyond new innovations,\nwe constantly explore ways to improve\nthe quality of existing popular plant-\nbased products \u2013 the Garden Gourmet\nSensational Burger is now even more\nflavorful and juicy. Our plant-based strategy is not only\nabout creating meat alternatives. The popular Maggi Veggie Masala\nNoodles has the same iconic taste\nas the original but now includes\nnutritious carrots and beans.",
            "Additionally, we launched the Nestl\u00e9 N3 range in China\nthat helps people maintain their overall health and well-\nbeing as they age. Expanding alternative proteins\nIn 2023, we added to our plant-based portfolio by\nlaunching a range of vegan alternatives to fish filets,\nnuggets and fingers that stand out for their strong\nnutrition credentials, as well as their great taste and\ntexture that is close to white fish. Garden Gourmet\nlaunched Marine-Style Crispy Filet and Marine-Style\nCrispy Nuggets in Europe, and Harvest Gourmet launched\nCrispy Fish-Free Fingers in Asia. We also continued to explore new concepts for dairy\nalternatives. Made with a blend of oat and fava, the new\nnatural bliss beverages are a good source of high-quality\nprotein.",
            "Nestl\u00e9 Annual Review 2021\n37\nAmong the plant-based options launched\nin 2021 are DiGiorno pizza with Sweet Earth\nAwesome Grounds, Wagner Rustipani flatbread\nwith vegetarian filet and Maggi Veg Atta\nspinach noodles. IN FIGURES\nConsumers are increasingly\ninterested in adopting healthier\nlifestyles that have less impact on\nthe environment. Nestl\u00e9 is positioned\nat the forefront of this trend, driving\ninnovation of plant-based food that is\nnutritious, delicious and sustainable. Our Garden Gourmet brand has a\nhistory of more than 30\u00a0years in plant-\nbased meat alternatives, making it a\npioneer in this category. Sweet Earth\nhas been providing flavor-forward\nplant-based ingredients and meals\nfor nearly a decade now."
        ],
        "reference": "This data does not exist in the corpus. The system must decline to answer because proprietary trade-secret recipes and ratios are excluded from investor-facing reports.",
        "faithfulness": 1.0,
        "answer_relevancy": 0.9999999999999997,
        "context_recall": 0.0,
        "context_precision": 0.3333333333
    },
    {
        "user_input": "What was the specific annual base salary and bonus payout for the factory manager of the Romont facility in Switzerland in 2021?",
        "response": "There is no information provided about the factory manager of the Romont facility in Switzerland. The text does mention a Global Sustainability Manager, Laurence Vernerey, who is from Nestl\u00e9 Health Science in Switzerland, but it does not provide any information about the salary or bonus payout for that person.\n\nHowever, the text does mention Regiane, a factory manager, but it does not specify which facility she works at. It also does not provide any information about her salary or bonus payout.\n\nThe text does mention the Nestl\u00e9 Annual Review 2022, but it does not provide any information about salaries or bonuses for specific employees. It does mention a dividend increase of 15 centimes to CHF 2.95 per share to be paid in April 2023, but this is related to shareholder compensation, not employee salaries or bonuses.",
        "retrieved_contexts": [
            "The salmon-based option sources\nsalmon from a sustainable wild-caught\nfishery in Norway. Garden of Life uses\nthe excess from the high-quality filet\ncuts destined for restaurants to make\nthe salmon protein powder. These new protein powders promote\nhealth and wellness while contributing\nto the circular economy. Good for you,\ngood for the planet. Enhancing\nhealth while\nupcycling\nOUR VOICES\n\u201cOur plant-based innovations\nstand out in meeting the\nstringent nutritional\nrequirements of consumers.\u201d\n1st\nsupplement company\nto be certified carbon\nneutral\nIN FIGURES\nLaurence Vernerey\nGlobal Sustainability\nManager\nNestl\u00e9 Health Science\nSwitzerland",
            "Customers and consumers rely on her\nto produce, pack and get products\nready for shipping on time. Working\nin a new digital environment means\nRegiane has access to real-time,\naccurate information, and always\nknows what is happening in the factory\nand on her line. That really helps her do\nher job. Regiane has the autonomy and the\ninformation to know exactly when she\nneeds to take a sample of a product\nor perform an analysis. When the time\ncomes to complete the documentation\nand release a batch for shipping, that is\nalso digital-based.",
            "C\nD\nB\nA\nE\nNestl\u00e9 Annual Review 2022\n9\nA  \tUSA\n~\u2009CHF 625 million\nUSD 675 million in\nnew beverage facility\nin Glendale, Arizona\nB \t Mexico\n~\u2009CHF 315 million\nUSD 340 million in\nnew Nescaf\u00e9 factory\nin Veracruz, Mexico\nC \t Brazil\n~\u2009CHF 50 million\nBRL 300 million to\nsupport Neo launch\nin Nescaf\u00e9 factory in\nMontes Claros, Brazil\nD \t Spain\n~\u2009CHF 99 million\nEUR 100 million for\ndigital technology in\nNestl\u00e9 coffee factory\nin Girona, Spain\nE  \tThailand\n~\u2009CHF 133 million\nTHB 5 billion in new\nPurina PetCare factory\nin Rayong, Thailand\nPotential acquisitions must have\u00a0a good strategic and\ncultural fit with our organization and offer attractive financial\nreturns. We look for creative ways to structure transactions\nand build partnerships that enhance our strategic options. We have demonstrated our commitment to maintaining\na high level of reinvestment into the business while at\nthe same time continually increasing capital returns to\nshareholders. We do this by increasing our dividend year\nafter year. Based on our 2022 performance, the Board of\nDirectors has proposed a dividend increase of 15\u00a0centimes\nto CHF\u00a02.95 per share to be paid in April 2023.",
            "Farmers in the program can engage\nin three levels of regenerative\nagriculture practices: bronze, silver\nand gold. For each level, the farmer\nreceives an extra bonus in pay per\nliter of milk. At the end of 2023,\n179\u00a0Nature por Ninho farms were\nin the gold category, supplying\n17\u00a0million liters of milk per month. In 2023, the Ninho team embarked\non a mission to communicate\nthese best farming practices to\nconsumers, sharing progress on\nthree pillars: animal welfare, soil\nand water. Through nationwide\ncommunication, including Ninho\nForti+ commemorative packs,\nmillions of Brazilian consumers\nare learning about the difference\nthat comes from the farm.",
            "Foreign exchange negatively impacted sales by\n7.6%, reflecting the appreciation of the Swiss franc\nagainst the Euro. Reported sales in Zone Europe\nincreased by 1.8% to CHF 19.1 billion. In a challenging environment, Zone Europe\ndemonstrated resilience and a commitment\nto invest for the long-term. In Ukraine, Nestl\u00e9\nannounced a CHF\u00a040\u00a0million investment for a new\nproduction facility in the Volyn region. The Zone saw market share gains in\nconfectionery, pet food and Infant Nutrition."
        ],
        "reference": "This data does not exist in the corpus. The system must decline to answer because granular, individual employee salary metrics at the factory level are omitted from these corporate reports.",
        "faithfulness": 0.8181818181818182,
        "answer_relevancy": 0.9199301707322695,
        "context_recall": 0.0,
        "context_precision": 0.0
    }
]